Rank,Name,image,Ratings,Price
1,RAG28 Wooden Wall Decor Set of 11 (SPW1) Multicolour,https://m.media-amazon.com/images/I/81GQfgl4cnL._AC_UL320_.jpg,3.9,5099
2,"ArtX Paper Motivational Wall Frames, Inspirational Quotes Wall Frames For Home Office Study Room Decor, Multicolor Posters...",https://m.media-amazon.com/images/I/61VDPBbPgHL._AC_UL320_.jpg,4.4,"50,399"
3,Mahogany Life Vintage Glass Hanging Photo Frame For Wall Decor (5X7 inch) | Transparent Glass and Brass Metal Hanging Pres...,https://m.media-amazon.com/images/I/81dRciG8gBL._AC_UL320_.jpg,4.2,5001
4,"Indianara Religious Painting -Synthetic Wood, 27X30.5X1cm, Multicolour (GB5)",https://m.media-amazon.com/images/I/91aG2syqs9L._AC_UL320_.jpg,4.5,5099
5,LeXton 20 Piece Photo Clips String Light Battery Powered (Battery Not Included) for Home Decoration (Warm White),https://m.media-amazon.com/images/I/51emgfV2MfL._AC_UL320_.jpg,4,5099
6,Rangoli Large Modern Art Wall Sticker Mullticolor Vinyl Sticker 40cm or 50 cm Pack of 1,https://m.media-amazon.com/images/I/61kr+OtuymL._AC_UL320_.jpg,3.9,5099
7,"Kridaykraft Metal Kuber Deepam Oil lamp for or Bringing Good Luck, Prosperity and Wealth,",https://m.media-amazon.com/images/I/81ZFDD-jQqL._AC_UL320_.jpg,4.5,5000
8,"Bubble Candle - Cube Soy WaX Candles, Home Decor Candle, Scented Candle Set 2 Pieces, Home Use and Gifting",https://m.media-amazon.com/images/I/51DEwbXiYMS._AC_UL320_.jpg,3.7,5099
9,Soul & Scents 120 ml Lavender Reed Diffuser Set | Free 6 Fiber Reed Sticks |ToXin Free & Stress Relief | Fine-Living Natur...,https://m.media-amazon.com/images/I/71DiTFFutBL._AC_UL320_.jpg,3.9,5099
10,"Ajanta Orpat Time Piece Beep Alarm Clock (Small_140X114X74 Mm, White,Plastic)",https://m.media-amazon.com/images/I/41capdtY8rL._AC_UL320_.jpg,3.9,5099
11,"Homenique Artificial Leaf Money Plant Greenery Fake Hanging Vine Plants Leaf Garland Hanging for Wedding Home Decoration, ...",https://m.media-amazon.com/images/I/81Na4VCwgDS._AC_UL320_.jpg,4.3,"50,350"
12,"SAF Set of 3 Buddha UV TeXtured Home Decorative Gift Item Painting , 18 Inch X 12 Inch - SANFJM31046, Figures, Religious",https://m.media-amazon.com/images/I/61wu5AOuAfS._AC_UL320_.jpg,4,5099
13,"Mangaldeep Puja Agarbatti, Sandal, 60 Sticks (Pack of 2)",https://m.media-amazon.com/images/I/81FXb9pmHdL._AC_UL320_.jpg,4.2,500
14,Krisah 1 pcs Lab Tested ISI Seal Original Sandalwood Scented Processed Mysore Chandan Sticks 30-40 Gram for Puja,https://m.media-amazon.com/images/I/61DcvGB107L._AC_UL320_.jpg,4.1,"50,345"
15,"HIVAGI Aromatherapy Essential Oil Diffuser with Flame Light, 180mL Quiet Mist Humidifiers for Essential Oils Home Aroma A...",https://m.media-amazon.com/images/I/51NmAVTPhxL._AC_UL320_.jpg,3.7,"50,000"
16,"Amazon Brand - Solimo Collage Set of 11 Black Photo Frames ( 4 X 6 Inch - 2 & 5 X 5 Inch - 6, 5 X 7 inch - 2 & 8 X 10 inch...",https://m.media-amazon.com/images/I/61u37A47BmL._AC_UL320_.jpg,4.2,5070
17,"Basement Bazaar Mahi Glass Hookah (24.8 cm, Black)",https://m.media-amazon.com/images/I/51hBBC+C63L._AC_UL320_.jpg,3.3,5049
18,"Reflekt Premium Hand Soap Sheets (Lavender) - Pack Of 80 Sheets In Storage Tin BoX | Moisturising Formula, Effective On Ge...",https://m.media-amazon.com/images/I/41Nsg6P+aSL._AC_UL320_.jpg,4.2,5099
19,"PRINTNET Pack of 28 BTS Polaroid photocards Collection for BTS Fans, Multicolour",https://m.media-amazon.com/images/I/61un-T16bYL._AC_UL320_.jpg,4.4,5029
20,SPHINX Artificial Marigold Fluffy Flowers Garlands Double line Door Toran Set/Door Hangings for Home Office Decoration (Ap...,https://m.media-amazon.com/images/I/71PewjbMeFL._AC_UL320_.jpg,4.3,5099
21,Aditya Shopping Electric Ceramic Kapoor Dani/Aroma Oil Burner Cum Night Lamp with Switch Design (Style 03),https://m.media-amazon.com/images/I/51D54r9lGHL._AC_UL320_.jpg,3,5099
22,World Fire Home Deco Purifying Brass Dhuna Loban Burner(Round),https://m.media-amazon.com/images/I/61f3mxtQcrL._AC_UL320_.jpg,4.1,"50,400"
23,"natureCRAFTS Wooden Coasters for Drinks Set of 6 with Iron Holder, Wooden and Iron Tea Coaster to Prevent Furniture from B...",https://m.media-amazon.com/images/I/71spMTWrbfL._AC_UL320_.jpg,4,5099
24,Gopz FleXible Mirror Sheets Self-Adhesive Plastic Mirror Tiles Non-Glass Mirror Stickers for Home Decoration [Size:- 30cm*...,https://m.media-amazon.com/images/I/31+W3bgdDZL._AC_UL320_.jpg,4.7,5099
25,"Itiha Gudi showpiece with Artificial Upturned Copper Vessel,Orange Saree, Leaf with Supari and Kalash on Wooden Base Gudi ...",https://m.media-amazon.com/images/W/IMAGERENDERING_521856-T1/images/I/71xdArkGYaL._AC_UL320_.jpg,4.1,5099
26,"Adiyogi Shiva Statue for Car Dash Board, Pooja & Gift, Mahadev Murti, Idol, Lord Adiyogi Shankara for home decor",https://m.media-amazon.com/images/W/IMAGERENDERING_521856-T1/images/I/71zVQAI8NUL._AC_UL320_.jpg,4.8,5099
27,DeLush Designs Delush2.4 inch Artificial Plumier Rubric Hawaiian Flower Petals Hair Hat Wreath Floral Hawaiian Foam Frangi...,https://m.media-amazon.com/images/W/IMAGERENDERING_521856-T1/images/I/51cSpXccqGL._AC_UL320_.jpg,3.4,5000
28,"Decals Design 'Romantic Rose Flowers' Wall Sticker (PVC Vinyl, 50 cm X 70 cm, Multicolour)",https://m.media-amazon.com/images/W/IMAGERENDERING_521856-T1/images/I/612d1-Fr3ZL._AC_UL320_.jpg,4.2,5064
29,Airkwick Freshmatic Room Freshner Refill 250 ml (Jasmine Blossom),https://m.media-amazon.com/images/W/IMAGERENDERING_521856-T1/images/I/31-sNDioXBL._AC_UL320_.jpg,3.5,5099
30,"Pindia PVC DIY 3D Butterfly Home Wall Decor Magnet Sticker for Living and Study Room, Fridge, AC, Nursery Decoration(Pink)...",https://m.media-amazon.com/images/W/IMAGERENDERING_521856-T1/images/I/511oHAQB0pL._AC_UL320_.jpg,3.7,5058
31,"Ajanta Quartz Plastic Digital Alarm and Table clock, (8 X 7 X 3.5 cm, White, ODC 190)",https://m.media-amazon.com/images/W/IMAGERENDERING_521856-T1/images/I/41qMkY1L81L._AC_UL320_.jpg,3.8,5040
32,Webelkart Diya Shape Flower Decorative Urli Bowl for Home Handcrafted Bowl for Floating Flowers and Tea Light Candles Hom...,https://m.media-amazon.com/images/W/IMAGERENDERING_521856-T1/images/I/81myv4fiv2L._AC_UL320_.jpg,4.4,"50,995"
33,TAZLYN Self Adhesive Mirror for Wall Sticker Mirror Stickers for Wall Mirror Stickers Mirror Stickers for Wall Bathroom Mi...,https://m.media-amazon.com/images/W/IMAGERENDERING_521856-T1/images/I/31fDQIdm8YL._AC_UL320_.jpg,4.2,5099
34,"Wallstick Motivational Buddha Quotes Vinyl Wall Stickers (115 cm X 60 cm, Multicolour, 57-3161)",https://m.media-amazon.com/images/W/IMAGERENDERING_521856-T1/images/I/61Xt+HCP2xL._AC_UL320_.jpg,4.4,5099
35,iCreations Acrylic Ganesha Customised Home Name Plate (Mirror Gold and Black),https://m.media-amazon.com/images/W/IMAGERENDERING_521856-T1/images/I/51SyIYoaMYL._AC_UL320_.jpg,4.4,5099
36,"AMB Fog Colours Eco-Friendly Fog Color Holi, Stage Performance, Party Decoration, Safe Hand Made in India, 5 Pieces in a BoX",https://m.media-amazon.com/images/W/IMAGERENDERING_521856-T1/images/I/61SrMUo9UlL._AC_UL320_.jpg,2.8,5099
37,"OXSAM Digital Smart Back Light Table Mirror Alarm Clock for Office, Home, and Bedroom with Sensor Date and Temperature (Wh...",https://m.media-amazon.com/images/W/IMAGERENDERING_521856-T1/images/I/61biAy-Mx8L._AC_UL320_.jpg,4.8,5099
38,Treasure House Mozo - Ultimate Brown Rolling Paper with Filter Tips (Pack of 5) by Treasure House.,https://m.media-amazon.com/images/W/IMAGERENDERING_521856-T1/images/I/911m0848tVL._AC_UL320_.jpg,4.3,5050
39,"Parag Fragrances Herbal & Natural 5 in 1 Dhoop Sticks 250Gm Pack / Rose, Sandalwood, Mogra, Camphor & Kasturi / 50Gram Eac...",https://m.media-amazon.com/images/W/IMAGERENDERING_521856-T1/images/I/91H+m52taGL._AC_UL320_.jpg,3.7,5050
40,"Seva Decorative sea shells, craft and decorative miX seashells 400gm pack",https://m.media-amazon.com/images/W/IMAGERENDERING_521856-T1/images/I/51o5wU2Kw6L._AC_UL320_.jpg,4.6,5099
41,Rajotia craft's Handmade Wooden Gangaur Ishar Figurines Size 16 inch,https://m.media-amazon.com/images/W/IMAGERENDERING_521856-T1/images/I/61+leM9+w1L._AC_UL320_.jpg,4,"50,999"
42,"Wolpin Wall Stickers Wallpaper Decal (45cm X 10 m) DIY PVC Self-Adhesive Bubbles, Kids Room, Lamination Paper, Office, Hom...",https://m.media-amazon.com/images/W/IMAGERENDERING_521856-T1/images/I/71l-ypP44RL._AC_UL320_.jpg,3.9,"50,499"
43,Healthbuddy Stoptar Smoking Filter 10 Packs Of 10 Pcs Each,https://m.media-amazon.com/images/W/IMAGERENDERING_521856-T1/images/I/51BHL5YPpmL._AC_UL320_.jpg,4.2,5000
44,"Heart Home Artificial Vine Plant with Plastic Pot (Green, 1 Piece)",https://m.media-amazon.com/images/W/IMAGERENDERING_521856-T1/images/I/711dsjFUKvL._AC_UL320_.jpg,4.2,5019
45,Chaka Chaundh - Suitable Abdul kalam photo frames for wall - motivational quotes frames - poster with frame - Abdul kalam ...,https://m.media-amazon.com/images/W/IMAGERENDERING_521856-T1/images/I/612qHYhLI6L._AC_UL320_.jpg,4.3,5099
46,RDK Original Sandalwood Sticks Scented Processed Mysore Natural Chandan Wood Lakdi for Pooja Tilak Havan & Beauty (35-45 G...,https://m.media-amazon.com/images/W/IMAGERENDERING_521856-T1/images/I/71RRPtyIY3L._AC_UL320_.jpg,3.8,2039
47,"HEM Precious Chandan Black Incense Sticks (120 Sticks) | Agarbatti for Pooja, Air Purifier & Meditation | Puja Room Items ...",https://m.media-amazon.com/images/W/IMAGERENDERING_521856-T1/images/I/616D7X33VHL._AC_UL320_.jpg,4,2049
48,ZinteX Metal Wall Clock for Home Decor and Hall Home Big Size Living Room Hall Bedroom Stylish Clock (Gold) (46X46),https://m.media-amazon.com/images/W/IMAGERENDERING_521856-T1/images/I/61wYaZ9EHPL._AC_UL320_.jpg,4.2,40569
49,"SATYAM KRAFT Acrylic Dancing Flame Led Tea Light Candle For Home Decoration, Gifting, House, Light For Balcony, Room, Birt...",https://m.media-amazon.com/images/I/41SFAv4E1hL._AC_UL320_.jpg,3.9,"48,200"
50,"Pink Pari 2 m Aluminium Foil Stickers, Oil Proof , Kitchen Backsplash Wallpaper Self-Adhesive Wall Sticker Anti-Mold and H...",https://m.media-amazon.com/images/I/71JLw26HyNL._AC_UL320_.jpg,3.9,4899
51,"Rey Naturals Lavender Essential Oil for Hair,Skin|100% Pure Lavender Oil with Natural Lavandula Angustifolia EXtract |Calm...",https://m.media-amazon.com/images/I/71nuGakORGL._AC_UL320_.jpg,4,4800
52,"Ryme Artificial Wild Grass Plant With Pot For Home And Office Decoration (Set Of 4, 4)( Set Of 4), Green",https://m.media-amazon.com/images/I/911uUtNB5oL._AC_UL320_.jpg,4,4899
53,"SADHUSADHYA 21 Shape of Mirror Craft (TOTAL-2100 Pices,100 Piece of Each Shape)",https://m.media-amazon.com/images/I/717GD9Za5rL._AC_UL320_.jpg,5,4899
54,TIMESETL Wood Coper Wind Chime for Home Bedroom Balcony Garden Etc. for (Decorate Item),https://m.media-amazon.com/images/I/710xUFpawML._AC_UL320_.jpg,4.1,"48,599"
55,"Blooming Floret Artificial Monstera Plant with Black Pot for Home, Office Decor | 18 Medium Size Leaves Plant with Pot",https://m.media-amazon.com/images/I/61xDV5GynTL._AC_UL320_.jpg,3.4,"48,000"
56,"Asian Paints Wall-Ons Scootaway Wall Sticker (PVC Vinyl, 0.01 cm X 76.2 cm X 30.48 cm) (AS05M)",https://m.media-amazon.com/images/I/61+Bu1bffKL._AC_UL320_.jpg,3.9,4865
57,SAF 7 Horses River Large Framed UV Coated Digital Reprint 14 Inch X 20 Inch Painting (SANFH11) SANFH11(multicolor1),https://m.media-amazon.com/images/I/71fbiLXHlpL._AC_UL320_.jpg,3.9,"48,999"
58,"Ajanta Quartz Plastic Abstract Rectangle Digital Alarm Wall Clock (Black and Brown, 29 cm X 19 cm X 2.5 cm, ODC 130)",https://m.media-amazon.com/images/I/311aGYbrKEL._AC_UL320_.jpg,3.7,"48,025"
59,"Generic PnF Durga Maa Religious Wood Photo Frames with Acrylic Sheet (Glass) for Worship/Pooja(photoframe,Multicolour,8X6i...",https://m.media-amazon.com/images/I/61DbiSMreIL._AC_UL320_.jpg,4.2,4899
60,Pauwer 12 Pack (43.2 FT) Artificial Wisteria Vine Ratta Fake Wisteria Hanging Garland Silk Long Hanging Bush Flowers Strin...,https://m.media-amazon.com/images/I/71I7VfA-ZqL._AC_UL320_.jpg,4,4899
61,"HOLD UP Led Vanity Lights for Mirror, Hollywood Style LED Vanity Mirror Lights Kit 10 Dimmable Light Bulbs 3 Color Modes, ...",https://m.media-amazon.com/images/I/61rISB71KkL._AC_UL320_.jpg,4.2,"48,499"
62,Urban Hamlet Iron Decorative Mirror Wall Mounted Hanging Mirror Sculpture Metal Golden Rose Design Modern Art Mirror for H...,https://m.media-amazon.com/images/I/91fMhIhHQbL._AC_UL320_.jpg,4.2,"48,999"
63,Shubhkart Nirmal 5 in 1 Agarbatti Zipper Pack 150grams - 9 Inch Long Sticks (Pack of 2)?22.86cm Long Sticks (Combo of 2)|...,https://m.media-amazon.com/images/I/61gFKyQgpVL._AC_UL320_.jpg,5,4840
64,"Painting Mantra Art Street Boulevard Photo Frame Set of 11 Picture Frames for Wall Hanging (8X10-3 pcs, 6X8-8 pcs)-Black a...",https://m.media-amazon.com/images/I/71LuwKCsyUL._AC_UL320_.jpg,4.2,"48,399"
65,"Golden bird 7.5 Inch Tall Glass Flower Vases, Bulk Plant Vases,1 Pack Modern Flower Vases for Home Dcor, Modern Decorativ...",https://m.media-amazon.com/images/I/81AeA9YuMEL._AC_UL320_.jpg,4.4,4899
66,Art Street A4 Document Photo Frame set of 2 Black Photo Frames for Home and Office decoration (Photo Size 8 X 12 Inches),https://m.media-amazon.com/images/I/71iO9dnGfdL._AC_UL320_.jpg,3.9,4899
67,Vintage Clock Iron Hand-Crafted Large Brass Colour Wall Clock (60 X 60 cm),https://m.media-amazon.com/images/I/71mdO-ohDmL._AC_UL320_.jpg,4.1,"480,596"
68,TIED RIBBONS Door Hanging Bandanwar Toran (101.6 cm X 10.1 cm) - Decoration Items for Home Dcor Bandanwar Toran for Main ...,https://m.media-amazon.com/images/I/815UPG7PRaL._AC_UL320_.jpg,4.2,4899
69,PRIMESKY Alarm Clock Brass Vintage Twin Bell Table Top Alarm Clock with Night Led Light Display Alarm Clock for Bedroom He...,https://m.media-amazon.com/images/I/61O9Dlh-Q6S._AC_UL320_.jpg,3.8,4899
70,Arsalan Arslan Decorative Mirror Wall Mounted Hanging Mirror Sculpture Metal Leaf Design Modern Art Mirror Home Decor (60 ...,https://m.media-amazon.com/images/I/51MdWP+tGPL._AC_UL320_.jpg,4.6,"48,999"
71,Oblivion Home Decoration Showpiece - Polyresin Miniature Buddha Monk Figurines Showpiece 6 cm - Pack of 4 (Multicolor),https://m.media-amazon.com/images/I/610qBiYQNGL._AC_UL320_.jpg,4.6,4885
72,"Perpetual Radha Krishna Wall Painting For Living Room - Set Of 5, 3d Scenery Wall Painting for Bedroom Large Size with Fra...",https://m.media-amazon.com/images/I/71XKMuoIepL._AC_UL320_.jpg,4.3,"48,699"
73,Collectible India 3.4-inch Cold Cast Bronze Lord Shiv Idol as Gifts (Multicolour),https://m.media-amazon.com/images/I/51BdrBhzfJL._AC_UL320_.jpg,4.6,"48,899"
74,SAF Panchmukhi Hanuman Framed Acrylic Glass Painting 14 inch X 11 inch SANFR33(Multicolor),https://m.media-amazon.com/images/I/81UQf2jjG8L._AC_UL320_.jpg,4.4,4899
75,TIED RIBBONS Ganesha Statue Playing Bansuri with with Wooden Flower Tealight Candle Holder Colorful Stones and Wooden Base...,https://m.media-amazon.com/images/I/81cKLmS9J1L._AC_UL320_.jpg,4.4,4899
76,Pure Source India Porcelain RelaXing Fragrance Aroma Set with 10 ml Aroma Oil and 4 Tea Light Candles (White),https://m.media-amazon.com/images/I/81wx3xU9lPL._AC_UL320_.jpg,4.3,"48,250"
77,SAF Set of 3 Beautiful Flower Pot UV TeXtured Self adeshive wall painting for living room with mdf 18 Inch X 12 Inch SANFJ...,https://m.media-amazon.com/images/I/61SSs-chWvL._AC_UL320_.jpg,3.7,4899
78,Aviraj (72 Cups) Guggal Dhoop Cup Sambrani Original I Loban Dhoop Cups for Pooja Pack of 6 Tray,https://m.media-amazon.com/images/I/914uQTpeALL._AC_UL320_.jpg,3.9,"48,200"
79,FOKRIM Black Marble Self Adhesive Wall Stickers Oil-Proof Waterproof Peel & Stick Contact Wallpaper for Kitchen Living Roo...,https://m.media-amazon.com/images/I/715TNrGzyMS._AC_UL320_.jpg,3.5,4899
80,"SAF Watercolor Modern Art Painting (Synthetic, 12 inch X 18 inch, Set of 3) SANFJMA9201-Multicolour",https://m.media-amazon.com/images/I/71FrfP2W9oL._AC_UL320_.jpg,3.9,"48,199"
81,Sohibe Multicolored Birds Handmade Hand Emboss Painted Bird Hanging for Garden Balcony Home Office Cafe Decoration Main Do...,https://m.media-amazon.com/images/I/81VKbGSZLBL._AC_UL320_.jpg,4.5,4899
82,"Amazon Brand - Solimo 12-inch Plastic & Glass Wall Clock - Melanie (Silent Movement, Black Frame)",https://m.media-amazon.com/images/I/71OjagLw6oL._AC_UL320_.jpg,4,"48,100"
83,SAF 6MM Ganesha Set of 3 Panel Digital Reprint 12 inch X 18 inch Painting SANFJM1003 Multicolor,https://m.media-amazon.com/images/I/71-zYGlY8+L._AC_UL320_.jpg,4.3,4899
84,"KUMAR INDUSTRIES Kumar Industries Wall Decorative Iron Flowers (Multicolour)(Artificial, 1.)",https://m.media-amazon.com/images/I/61fk4qFRq3L._AC_UL320_.jpg,4.3,"48,349"
85,"S K D Pure Original Natural Loban (100 gm), Sambrani Benzoin Herbal Dhoop for Pooja, Hawan, Home Fragrance",https://m.media-amazon.com/images/I/814xzsrikLL._AC_UL320_.jpg,3.4,4899
86,Shubhkart Nirmal Raatrani Agarbatti Zipper and Rajanigandha Agarbatti Zipper - 9 Inch Long Sticks (Combo of 2),https://m.media-amazon.com/images/I/61k1OI9AsOL._AC_UL320_.jpg,3.9,4830
87,FIFA World Cup Trophy (Replica),https://m.media-amazon.com/images/I/71iHP+Y6EfL._AC_UL320_.jpg,3.9,4899
88,BHAJANLAL GREENERY Vastu Hawan Sambrani Cups for Holistic Atmosphere & Fresh Mind. (Pack of 24 Cups),https://m.media-amazon.com/images/I/31ZpG6uIT1L._AC_UL320_.jpg,3.5,4800
89,Pure Source India Handcrafted Soapstone Aroma Burner Oil Diffuser and 1 Tea Light Candle (Natural) (Natural),https://m.media-amazon.com/images/I/61VS67GKroL._AC_UL320_.jpg,4.1,4899
90,"Interio Crafts Iron Bird Lantern with Bells and Wall Stand, Lantern with T-Light and Diya Holder for Home and Garden Decor...",https://m.media-amazon.com/images/I/714SCs7k0hL._AC_UL320_.jpg,4.6,"48,999"
91,Titan Contemporary Wooden Finish White Wall Clock with Thermometer & Hygrometer - 30 cm X 30 cm (Medium),https://m.media-amazon.com/images/I/61zKqyNtXZS._AC_UL320_.jpg,4.2,"48,695"
92,FARKRAFT White Donut Vase Ceramic Vase for Pampas Grass Home Decor Items for Living Room Bedroom Accessories Dried Flower ...,https://m.media-amazon.com/images/I/61dbkrT-SVL._AC_UL320_.jpg,4.4,4899
93,QROUN CERAMICS Islamic Wall Clock Surah Al Ikhlas Acrylic Islamic Clock | Islamic Wall Art Wall Clock Black and Golden Col...,https://m.media-amazon.com/images/I/61godEcVGVL._AC_UL320_.jpg,3.4,
94,"Onlinetree 5 in 1 Rose, Sandal, Loban, Mogra, Pineapple Flavour Fragrance Agarbatti/Incense Sticks/for Pooja/Mandir 900 Gram",https://m.media-amazon.com/images/I/71qkP+H5lJL._AC_UL320_.jpg,3.9,4899
95,"SOFIX Beautiful Artificial Pink Flower Pot- 40cm (Pink), Artificial Flora",https://m.media-amazon.com/images/I/61IEbQJOGLL._AC_UL320_.jpg,4.1,4899
96,THE NILGIRIS EUCALYPTUS OIL & ESSENTIAL OILS DISTILLERY TNEOEOD Pure and Natural Therapeutic Grade A Ooty Eucalyptus Oil 3...,https://m.media-amazon.com/images/I/41YBiNGDfvL._AC_UL320_.jpg,4,4800
97,Amazon Brand - Presto! Naphthalene Balls - 200 g (Pack of 10),https://m.media-amazon.com/images/I/71WJoUNevBL._AC_UL320_.jpg,4.3,"48,000"
98,Collectible India Brass Diya Lamp Lotus Shape -Decorative Akhand Deepak for Pooja - Set of 2 (Gold_3 X 3 X 1.5 Inches),https://m.media-amazon.com/images/I/71cOaj+wTvL._AC_UL320_.jpg,3.8,4899
99,Crafts World Wooden Home Decorative Wall Hanging | Printed Designer Wall Hanging | Home Decor | Wall Hanging For Living Ro...,https://m.media-amazon.com/images/I/71p+gnPnyAL._AC_UL320_.jpg,4.2,4899
100,"AIR-ROMA Combo of 2 Air Freshener Spray, Fragrance- Rose Original & Jasmine Flower (400ml)",https://m.media-amazon.com/images/I/51uuN7mA7+L._AC_UL320_.jpg,3.9,4898
101,"Decals Design 'Green Autumn Leaves Branch' Wall Sticker (PVC Vinyl, 50 cm X 70 cm, Green)",https://m.media-amazon.com/images/I/51WytrjUnCL._AC_UL320_.jpg,4.1,4864
102,3V PRODUCTS: Dasangam Powder 50g | Bhuvaneswari Dasangam Dhoop Powder for Pooja & Home,https://m.media-amazon.com/images/I/91+zdc8GDDL._AC_UL320_.jpg,4.1,4810
103,Baburao Fridge Magnet- Pack of 1 Bollywood Theme Fridge Magnets,https://m.media-amazon.com/images/I/51mvpy6v9rL._AC_UL320_.jpg,4.5,4899
104,HOKIPO Eco-Friendly Bamboo Wooden Coasters for Home Pan Pot Holder for Dining Table Heat Pad for Kitchen - Pack of 4 (AR2...,https://m.media-amazon.com/images/I/817QGF--OvL._AC_UL320_.jpg,4,4849
105,"DESHABOINA VN Plastic Nazar Suraksha Kawach, Evil Eye Protector, Drishti Bommai, Nazar Battu (Large) for House, Office, Sh...",https://m.media-amazon.com/images/I/71DwMZMNJjL._AC_UL320_.jpg,3.9,4899
106,"Litleo Artificial Flowers with Wooden Pot (Yellow, 2 Piece)",https://m.media-amazon.com/images/I/81gcdNOfE+S._AC_UL320_.jpg,3.8,4849
107,"Pure Source India Aroma Essential Oils 9 Fragrances In 1 Pack, 10 Ml Each, (Fragrances: Lemon Grass, Lavender, Jasmine, Ro...",https://m.media-amazon.com/images/I/91j6dTfEGnL._AC_UL320_.jpg,4,4899
108,Borosil Medium Brass Diffuser (Multicolour) (HDDBBSP0100),https://m.media-amazon.com/images/I/6108lemNjyL._AC_UL320_.jpg,4.2,4895
109,TIED RIBBONS Green Ficus Artificial Plant with Pot Stand (1 Feet) Natural Looking Artificial Plants for Home Decor Living ...,https://m.media-amazon.com/images/I/71j2Td5nHLL._AC_UL320_.jpg,Get,"48,749"
110,Loop Group  Wooden Tabletop Makeup Mirror Vanity Table Stand Mirror Swivel Bamboo Mirror for Bedroom Bathroom Desk (Squar...,https://m.media-amazon.com/images/I/61+uPKVnuAL._AC_UL320_.jpg,3.4,"48,600"
111,Shri Kanth Art Multi Plate Wooden Wall Hanging | Wall Hanger for HomeDecor |Wall Art | Gifts | Office | Wooden Home Decor ...,https://m.media-amazon.com/images/I/61ODS0vfpNL._AC_UL320_.jpg,4.7,4899
112,CraftVatika Ganesh Idol Murti Statue for Car Dashboard Gift Lord Ganesha Ganpati Idols Showpiece Figurine for Home Pooja R...,https://m.media-amazon.com/images/I/71RcgSvkUmL._AC_UL320_.jpg,4.4,4899
113,"SN Handicrafts Stone Adiyogi Shiva Mahadev Murti for Car Dashboard, Pooja, Home and Office Decor - 5.35 inch (Matte Black,...",https://m.media-amazon.com/images/I/51DLABxQmWL._AC_UL320_.jpg,4.2,4899
114,"Ikea Digital Multi Purpose ABS plastic Alarm Clock for Bedroom, Has Thermometer, Timer, Alarm (White)",https://m.media-amazon.com/images/I/314TVRbVwXL._AC_UL320_.jpg,4.1,4811
115,VRB DecTM Artificial Greenery Ferns Plants Vines Fake Ivy Hanging Flowers Vine Pine Needle Wall Hanging for Home Decor Doo...,https://m.media-amazon.com/images/I/71irKocKsRL._AC_UL320_.jpg,3.5,"48,249"
116,"PUTHAK Plastic Mallow Vase for Flowers, Unbreakable Vase, 8.5X3.5Inch Ceramic Look Flower Vase, Decorative Modern Floral V...",https://m.media-amazon.com/images/I/61NbqCNCi5L._AC_UL320_.jpg,4,4899
117,"BUYERZONE WITH BZ LOGO BUYERZONE Smart Night Light Plastic Digital Alarm Clock with Date & Indoor Temperature, Battery Ope...",https://m.media-amazon.com/images/I/416xPg8QGdL._AC_UL320_.jpg,4.1,4899
118,"ArtX Paper Motivational Wall Frames Quotes Wall Art Painting, Framed Paintings For Home Office Decor, 20 X 20 inches (Comb...",https://m.media-amazon.com/images/I/612KGOdwW-S._AC_UL320_.jpg,4.5,"48,399"
119,Odonil Bathroom Air Freshener Blocks - 150g (75g*2) | Long Lasting Fragrance,https://m.media-amazon.com/images/I/71LIagxqFAL._AC_UL320_.jpg,4.2,4824
120,"VAH-Kya Bat Hai !! Moment Photo Frame Black Colour Self Adhesive Wall Hanging for Bed Room, Living Room, Birthday, him wit...",https://m.media-amazon.com/images/I/61EM0y184zL._AC_UL320_.jpg,4,"48,999"
121,"Plus Value Feng Shui Golden Arowana Fish Strong Wealth Symbol & Protects Mishaps, Troubles Vastu Products Home & Office, F...",https://m.media-amazon.com/images/W/IMAGERENDERING_521856-T1/images/I/71y5MBbmK5L._AC_UL320_.jpg,4.3,"48,500"
122,i Creations Personalised Home Name Plate with Golden Acrylic embossed Letters wooden background (9 X 16 Inch),https://m.media-amazon.com/images/W/IMAGERENDERING_521856-T1/images/I/81C1pWbPS3L._AC_UL320_.jpg,4.5,"48,499"
123,Oreva Round Plastic Wall Clock (32 cm X 4 cm X 32 cm) White Dial and Silver Rim AQ-1687,https://m.media-amazon.com/images/W/IMAGERENDERING_521856-T1/images/I/517A-CswL6L._AC_UL320_.jpg,3.8,4825
124,Gesto LED String Lights - 20 Meter Fairy Lights with 360 Degree Light LED Bulb - Waterproof & Bendable Copper LED Serial L...,https://m.media-amazon.com/images/W/IMAGERENDERING_521856-T1/images/I/71Z1WG8StsL._AC_UL320_.jpg,3.8,"48,999"
125,R Ayurveda Copper Decorative Metal Diya Traditional Diya Urli Tealight Holder Golden Bowl for Floating Flowers and Tea Lig...,https://m.media-amazon.com/images/W/IMAGERENDERING_521856-T1/images/I/61FQOlOUoxL._AC_UL320_.jpg,3.6,"48,599"
126,Air freshener Flowers Block for Bathroom and Toilet 60 gm Each - Pack of 6,https://m.media-amazon.com/images/W/IMAGERENDERING_521856-T1/images/I/51OhgZcm7GL._AC_UL320_.jpg,2.9,4899
127,FOKRIM Black Vinyl Marble Aluminum Foil Kitchen Stickers Oil-Proof Waterproof Self Adhesive Wallpaper PVC Bathroom Wall St...,https://m.media-amazon.com/images/W/IMAGERENDERING_521856-T1/images/I/715qADBtO5L._AC_UL320_.jpg,3.6,4899
128,"wolpin Wall Stickers Wallpaper (45 X 300 cm) Living Room, Bedroom, TeXtured Embossed Peony Roses Decal Floral Home Decorat...",https://m.media-amazon.com/images/W/IMAGERENDERING_521856-T1/images/I/811CkE5iJHL._AC_UL320_.jpg,4,"48,499"
129,Glade Touch 'n' Fresh Wild Lavender Refill (12 ml),https://m.media-amazon.com/images/W/IMAGERENDERING_521856-T1/images/I/71m6Wrab1pL._AC_UL320_.jpg,4.4,485
130,PARKOTA HOUSE Designer Home Dcor Ganesh Mantra Wooden Wall Hangings for home living room bedroom-Large Size Multicolor (M...,https://m.media-amazon.com/images/W/IMAGERENDERING_521856-T1/images/I/61JjVpkJaeL._AC_UL320_.jpg,4.6,4899
131,Paper Plane Design wall door hanging wooden home decoration item (MUMMY),https://m.media-amazon.com/images/W/IMAGERENDERING_521856-T1/images/I/61P9HpTgowL._AC_UL320_.jpg,4.3,4899
132,"DECORIA Decor Home Metal Flower Wall Art Decor Large Indoor Wall Hanging Sculptures, Natural Art Home Decoration for Home ...",https://m.media-amazon.com/images/W/IMAGERENDERING_521856-T1/images/I/71RSvdV459L._AC_UL320_.jpg,3.7,"48,999"
133,PAPER PLANE DESIGN wall hanging decor home decoration item (FAMILY),https://m.media-amazon.com/images/W/IMAGERENDERING_521856-T1/images/I/71Q4GM1rDWL._AC_UL320_.jpg,4.2,4899
134,"JaipurCrafts Webelkart Cast Iron Wall Hanging Showpiece (22.86 X 2.54 X 22.86, Multicolour, Religious)",https://m.media-amazon.com/images/W/IMAGERENDERING_521856-T1/images/I/81fPBFwnggL._AC_UL320_.jpg,4.3,"48,799"
