Rank,Name,image,Ratings,Price
528,Telugu Wedding Pallaki Terachala/Terapatram/Addutera (Without Stone),https://m.media-amazon.com/images/I/81NFAtRIqkL._AC_UL320_.jpg,4.2,4870
529,"WallDaddy Fridge Stickers & Wall Stickers, Beautiful Fridge Decorative Sticker Wallpaper Poster (PVC Vinyl) Large Size (60...",https://m.media-amazon.com/images/W/IMAGERENDERING_521856-T2/images/I/61daHtw4smL._AC_UL320_.jpg,2.7,4899
530,Chaka Chaundh - Compatible bathroom poster - bathroom posters with frame - bathroom quotes framed posters - Washroom Quote...,https://m.media-amazon.com/images/W/IMAGERENDERING_521856-T2/images/I/71mD7bitQ6L._AC_UL320_.jpg,4.3,"48,769"
531,Wolpin Wall Stickers Wallpaper Home Decoration (45 X 300 cm) 3D Effect Bricks Pattern Stylish Office Decor PVC Vinyl Self ...,https://m.media-amazon.com/images/W/IMAGERENDERING_521856-T2/images/I/81H9X7DR0aS._AC_UL320_.jpg,4,"48,499"
532,"Techtonemagnetics FleXible Magnetic Sheets (Brown, 2 Pieces, 30CmX30Cm, 2Mm Thick)",https://m.media-amazon.com/images/W/IMAGERENDERING_521856-T2/images/I/717xCg9CbJL._AC_UL320_.jpg,3.6,4899
533,VITARA [ Pack of 50 ] Premium Desi Cow Dung Dhoop Batti Organic Incense Stick dhup for Puja and Mosquito Repellent 100% Or...,https://m.media-amazon.com/images/W/IMAGERENDERING_521856-T2/images/I/716ltVGNTjL._AC_UL320_.jpg,4.2,4899
534,"CraftVatika Metal Flower Vase with Crystal Studded, Decorative Golden Metal Flower Vase for Home Office Gift, (6 Inch Height)",https://m.media-amazon.com/images/W/IMAGERENDERING_521856-T2/images/I/616+O-DkvSL._AC_UL320_.jpg,3.3,4899
535,"Asian Paints Wall-Ons Maroon Motif Wall Sticker (PVC Vinyl, 0.01 cm X 76.2 cm X 30.48 cm, Maroon)",https://m.media-amazon.com/images/W/IMAGERENDERING_521856-T2/images/I/715bl6z2snL._AC_UL320_.jpg,3.8,4865
536,SAF Set of 3 Flower Pot UV teXtured Paintings for living room with frame Painting 12 Inch X 18 Inch SAF-JMS71,https://m.media-amazon.com/images/W/IMAGERENDERING_521856-T2/images/I/71vSNJduJWL._AC_UL320_.jpg,3.8,4899
537,Handmade Clay Hut Lamp / Tealight / Oil Lamps for Puja (RED),https://m.media-amazon.com/images/W/IMAGERENDERING_521856-T2/images/I/71HHmPryboL._AC_UL320_.jpg,4.3,4899
538,"SUVASANE Paddy Torana with Paddy Grains,1 Natural Paddy Door Torana 3.5 feet (1 Paddy Torana Length-42inches) Height-9 inches",https://m.media-amazon.com/images/W/IMAGERENDERING_521856-T2/images/I/712We+6u6CL._AC_UL320_.jpg,4.4,4899
539,"Smoking Pipe Cigarette Filter Holder Multi-Filtering to Reduce Tar and Smoke Stains Portable Reusable Food Grade Plastic, ...",https://m.media-amazon.com/images/W/IMAGERENDERING_521856-T2/images/I/61DbEOqcqjL._AC_UL320_.jpg,3.3,4899
540,"IRIS 50 Garden Incense (16"",Green)",https://m.media-amazon.com/images/W/IMAGERENDERING_521856-T2/images/I/51ShhyjNIbL._AC_UL320_.jpg,4.5,4875
541,Den Art Flower Metal Wall Art | Modern | Standard (Grey White Gold)07,https://m.media-amazon.com/images/W/IMAGERENDERING_521856-T2/images/I/51bPDBKbxbL._AC_UL320_.jpg,4.5,"48,400"
542,"Decals Creation Royal Enfield Bike Wall Sticker for Living Room, Bedroom, Kids Room (Size - 50 CM X 80 Cm)",https://m.media-amazon.com/images/W/IMAGERENDERING_521856-T2/images/I/61r1tr0WbEL._AC_UL320_.jpg,4,4849
543,Sapi'S Pure WaX Unscented Pillar Candles (1.5X4 Inches) | Home Decoration Candles | Diwali Candle | Birthday Candle | Vale...,https://m.media-amazon.com/images/W/IMAGERENDERING_521856-T2/images/I/41cK9+hJ-fL._AC_UL320_.jpg,3.4,4800
544,EXclusiveLane 'The Elephant Warriors' Hand Carved Multi-Utility Tea BoX in Sheesham Wood (4 Compartments) -Wooden BoX Tea BoX,https://m.media-amazon.com/images/W/IMAGERENDERING_521856-T2/images/I/619tpstb2NL._AC_UL320_.jpg,4.3,"48,799"
545,"Rangoli Wood Painting, Multicolour, Abstract, Standard",https://m.media-amazon.com/images/W/IMAGERENDERING_521856-T2/images/I/81PQ7eYn1oL._AC_UL320_.jpg,4.2,4899
546,"Generic Feng Shui Owl for Money and Wisdom Showpiece - 10 cm by Make in India, Full (Pro_Pooja_MININ_04), Resin, Golden, 1...",https://m.media-amazon.com/images/W/IMAGERENDERING_521856-T2/images/I/81cgQ-5Kb4L._AC_UL320_.jpg,3.5,4899
547,"RIZIK STOREMetal Abstract Figures handcrafted Wall Sculpture wall art multicolor for Home Decoration, Living room, drwai...",https://m.media-amazon.com/images/W/IMAGERENDERING_521856-T2/images/I/71WeOHe13jL._AC_UL320_.jpg,3.9,"48,999"
548,"Sheer Veda Lavender Oil Essential Oil, Pure, Natural and Undiluted for Skin, Hair and Aromatherapy. (15)",https://m.media-amazon.com/images/W/IMAGERENDERING_521856-T2/images/I/61pkKJLuhEL._AC_UL320_.jpg,4.2,4899
549,Glass Planter Holder Deer |Glass Pot| Glass Flower Pot| Glass Flower Round Vase Handmade for Home Decor [Set of 2] [Gold],https://m.media-amazon.com/images/W/IMAGERENDERING_521856-T2/images/I/41KM9zg1G9L._AC_UL320_.jpg,4.2,"48,450"
550,Artvibes Motivational Quotes Decorative Wall Art MDF Wall Hanger for Living Room |Artworks Wall Hangings (WH_4412N)(Multi 17),https://m.media-amazon.com/images/W/IMAGERENDERING_521856-T2/images/I/71yxdp+QgSL._AC_UL320_.jpg,4.6,4899
551,"EXploring India Ashok Stambh/Ashoka Pillar Wooden (New Parliament Design,8 inch/21cm, Hand-Carved) (Design 2)",https://m.media-amazon.com/images/W/IMAGERENDERING_521856-T2/images/I/61x048dHceL._AC_UL320_.jpg,4.7,4850
552,"EXclusiveLane Warli Hand-Painted Living Room & Home Decorative Miniature Terracotta Pots Showpiece Set (Small, 7.6 cm X 7....",https://m.media-amazon.com/images/W/IMAGERENDERING_521856-T2/images/I/6119Rr2bW7L._AC_UL320_.jpg,3.9,4870
553,"ArtX Paper Village Women Wall Art Painting, Multicolor, Village, 13 X 22 Inches, Set of 3",https://m.media-amazon.com/images/I/71i67mle6ML._AC_UL320_.jpg,4.2,4842
554,"Upaharam Customised/Personalized Clear Acrylic Wall Mount Frameless Picture Photo/Poster Frame For Anniversary, Birthday, ...",https://m.media-amazon.com/images/I/6186wSG7sbL._AC_UL320_.jpg,5,"48,098"
555,PiXelkari - Personalised Classic Photo Lamp with photos (10 inch) | Best Personalised Anniversary & Valentine Gift |Weddin...,https://m.media-amazon.com/images/I/51lzg75H+aL._AC_UL320_.jpg,4.2,"48,099"
556,"Parag Fragrances Fresh Tuberose / Rajnigandha Essential Oil Room Spray / Air Freshner / Room Freshner For Home, Car & Offi...",https://m.media-amazon.com/images/I/81HzmbPDtnL._AC_UL320_.jpg,3.7,4899
557,Bhimonee Decor by Modern Gift Centre shanku Chakra Namah Stone Work Showpiece for Car Dashboard| Pooja|Puja,https://m.media-amazon.com/images/I/81P+2YuIanS._AC_UL320_.jpg,4.5,4899
558,Phool Lavender Incense Sticks I Pack of 80 Agarbatti I Incense for Good Sleep I Sulpher & Charcoal Free | 100% Organic ( 2...,https://m.media-amazon.com/images/I/61vGfJk0dBL._AC_UL320_.jpg,4,4845
559,Enamic UK H-032 Plastic Premium 5 Layer Electric Gold LED Bulb Lights Diya for Pooja Mandir Diwali Festival Decoration -Pa...,https://m.media-amazon.com/images/I/51K8cQZGfxL._AC_UL320_.jpg,3.9,4899
560,BAKEFY- Golden 3 Bunch Beery Artificial Berry Stems Christmas Glitter Berries Artificial Fruit Berry Holly Flower Branch ...,https://m.media-amazon.com/images/I/81rrPTe8e7L._AC_UL320_.jpg,2.5,4899
561,"HC VILLA EXclusive KHATU Shyam JI Murti Fountain Smoke Backflow Cone Incense Holder (12cm Height, Red & Golden) with 10 Fr...",https://m.media-amazon.com/images/I/611-+E41ZvL._AC_UL320_.jpg,5,4899
562,"Meet Cute Polyvinyl Chloride Kitchen Oil-Proof Temperature Resistant and Waterproof Transparent Wall Sticker (Clear, 60 X ...",https://m.media-amazon.com/images/I/51QKSoS6gTL._AC_UL320_.jpg,3.8,"48,050"
563,THE BRIDE MADE Engagement Ring tray ring holder platter King Queen,https://m.media-amazon.com/images/I/91wnWTYya1L._AC_UL320_.jpg,4.2,4899
564,SAF Set of 5 Buddha UV TeXtured Home Decorative Gift Item MDF Panel Painting 18 Inch X 42 Inch SANFPNL31190,https://m.media-amazon.com/images/I/714Zv0px7YL._AC_UL320_.jpg,4.1,"48,599"
565,"WallDaddy- Scrapbook Crafts (Wonders Photo) Scrap Book | Wooden Photo Album | 40 Black Color Paper Size ""22 X 16 cm"" Woode...",https://m.media-amazon.com/images/I/71kBJoyZn3L._AC_UL320_.jpg,4.7,4899
566,"Aroma GalaXy Natural Lemongrass Room & Linen Spray - Sheets, Pillow, Fabric, Bed Air Freshener & Deodorizer - Calming Frag...",https://m.media-amazon.com/images/I/71OHZ6vK5SL._AC_UL320_.jpg,3.6,4800
567,S A Manufacture Taj Bowl Hammered Urli Candle Stand with Floating Diya | Urli for Home Decor and Festival Decor Urli Show ...,https://m.media-amazon.com/images/I/711jZ0HbSjL._AC_UL320_.jpg,3.7,"48,999"
568,"YOTINO Paper Door Wall Sticker (60 X 500 cm, Transparent)",https://m.media-amazon.com/images/I/51NhHTdpqoL._AC_UL320_.jpg,3.9,"48,850"
569,"SV ENTERPRISE Metal Bong Shooter Pipe, Multicolour (Pack of 2) (8 CM)",https://m.media-amazon.com/images/I/41EfKf0CsRL._AC_UL320_.jpg,3.7,4899
570,"Good Hope - Pink Floyd Framed Poster Acrylic Glass for Room & Office (Multicolor, 10 Inch X 13 Inch)",https://m.media-amazon.com/images/I/71vaGqFZKYL._AC_UL320_.jpg,4.6,4899
571,"AG CraftsA4 (13.75""X9.75"") Picture Photo & Document Frames -0012 (Black)",https://m.media-amazon.com/images/I/81eLInrMKSL._AC_UL320_.jpg,4,"48,499"
572,NIRAJ ART Marble Panchmukhi Hanuman Ji Fengsui Idol for Car Dashboard Showpiece Statue(White)(3-Inch),https://m.media-amazon.com/images/I/41YDIUYDj4L._AC_UL320_.jpg,4.5,4899
573,"Lamy Cartridges Refill - Pack of 5, Blue",https://m.media-amazon.com/images/I/61SSDmduAiL._AC_UL320_.jpg,4.6,4850
574,"Wolpin Wall Stickers DIY Botanical Wallpaper Decal (45 X 500 cm) 3D Brick Self Adhesive House Office Decorative PVC Vinyl,...",https://m.media-amazon.com/images/I/91J3e0+rRmL._AC_UL320_.jpg,4.2,"48,499"
575,"Pure Source India Rattan & Wicker Spiral Reed Sticks (6 inch, Multicolour)",https://m.media-amazon.com/images/I/71MItkt7YVS._AC_UL320_.jpg,3.6,4899
576,Generic Products Hanture Golden Small Metal Photo Picture Frame Hook Hanger Triangle Ring Single Hole with Screws (P_10) -...,https://m.media-amazon.com/images/I/61TE0ZMxA1L._AC_UL320_.jpg,4.2,4849
577,"Univocean Vinyl PVC Abstract Wall Sticker, 200 X 45 cm, Multicolour",https://m.media-amazon.com/images/W/IMAGERENDERING_521856-T1/images/I/81f2TAk05mL._AC_UL320_.jpg,4,4899
578,"Spefez Kapoor Dani Incense Holder Electric Camphor Burner Beautiful Smart Ceramic Kapur Dani Night Lamp with Switch,Aroma ...",https://m.media-amazon.com/images/W/IMAGERENDERING_521856-T1/images/I/61xwNgUOtaS._AC_UL320_.jpg,4.2,4899
579,"Decals Creation Vinyl Botanical Air Conditioner Sticker (1.57X13.77X1.57 inches, Multicolour)",https://m.media-amazon.com/images/W/IMAGERENDERING_521856-T1/images/I/61LFcZ8sYWL._AC_UL320_.jpg,4.1,4850
580,"Tej Gifts Microfiber Diamond Studded Umbrella Chhatra with Crystal Hanging for God Idol, Car Dashboard/Office Desk/Table/H...",https://m.media-amazon.com/images/W/IMAGERENDERING_521856-T1/images/I/81mYXle0GYL._AC_UL320_.jpg,4,4899
581,WALLSTICKS ' Hindu - God - Lord - Siva - Meditating - Shiva - Inspirational - Motivational - Quote - Wall Sticker ' - WS12...,https://m.media-amazon.com/images/W/IMAGERENDERING_521856-T1/images/I/51oQDLcEpxL._AC_UL320_.jpg,4.2,4879.5
582,Bnezz -16 Big Square Silver Mirror for Wall Stickers Large Size (15X15)Cm Acrylic Mirror Wall Decor Sticker for Bathroom M...,https://m.media-amazon.com/images/W/IMAGERENDERING_521856-T1/images/I/61Kys8EZIIL._AC_UL320_.jpg,3,4899
583,Airwick Air Freshener Refill 250ml White Flowers,https://m.media-amazon.com/images/W/IMAGERENDERING_521856-T1/images/I/51Shs0leCzS._AC_UL320_.jpg,4.1,4899
584,Heartily Navrang Beautiful Wooden Pooja Stand for Home/Mandir for Home/Temple for Home and Office/Puja Mandir for Home an...,https://m.media-amazon.com/images/W/IMAGERENDERING_521856-T1/images/I/910iN54k8wL._AC_UL320_.jpg,4.1,"48,499"
585,"BS AMOR Dream Catcher with Lights Wall Hangings, Crafts, Home Decor, Bedroom, Balcony, Garden, Party, Caf, Decoration, We...",https://m.media-amazon.com/images/W/IMAGERENDERING_521856-T1/images/I/718qf242V-L._AC_UL320_.jpg,4.2,4899
586,Freny EXim MDF Wooden Gayatri Mantra Decorative Wall Hanging Art Decoration Itam For Home | Living Room | Bedroom | Home D...,https://m.media-amazon.com/images/W/IMAGERENDERING_521856-T1/images/I/81o-4wWhjBL._AC_UL320_.jpg,4.2,4899
587,PickEndNow Antique Brass Made Lord Ram Darbar | Religious Indian Art Statue/Idol (lXbXh - 3.0 X 1.0 X 3.2 Inches),https://m.media-amazon.com/images/W/IMAGERENDERING_521856-T1/images/I/61ztMJvB8tL._AC_UL320_.jpg,4.3,4899
588,"Paper Cute Babies / Children Poster, Multicolour, Medium",https://m.media-amazon.com/images/W/IMAGERENDERING_521856-T1/images/I/61HwaOiy1sS._AC_UL320_.jpg,4.4,4850
589,"Vintage Product Victoria Iron Dia Retro Double Sided Station Railway Wall Clock (Black, 8 Inch)",https://m.media-amazon.com/images/W/IMAGERENDERING_521856-T1/images/I/51ClF8qJc8S._AC_UL320_.jpg,4.3,"48,500"
590,casa rica Allah Muhammad / Masha Allah /Jannat Ka darwaza Islamic Muslim Photo Frame Painting Wall Hanging home decoration...,https://m.media-amazon.com/images/W/IMAGERENDERING_521856-T1/images/I/81DheT3CeWL._AC_UL320_.jpg,4.3,"48,199"
591,"Himgiri Lavender Aroma Oil for Diffuser, Home Fragrance- 100ml",https://m.media-amazon.com/images/W/IMAGERENDERING_521856-T1/images/I/71kH8EA9m6L._AC_UL320_.jpg,3.3,4800
592,"Design Toscano Chicory The Chimpanzee Baby Monkey Hanging Animal Statue, 16 '', Polyresin, Full Color",https://m.media-amazon.com/images/W/IMAGERENDERING_521856-T1/images/I/71P4uh4mJ9L._AC_UL320_.jpg,4.8,"48,999"
593,JAINSONS PET PRODUCTS Copper Water Fountain Power 5W Flow Rate 300L/H MAX height:1/2 MTR (Black Grey),https://m.media-amazon.com/images/W/IMAGERENDERING_521856-T1/images/I/31mQoGOhdLL._AC_UL320_.jpg,3.7,4899
594,AMFIN Candles for Decoration / Candles for Birthday Theme / Kids Girls Birthday Candle / Mermaid Candle for Decoration / ...,https://m.media-amazon.com/images/W/IMAGERENDERING_521856-T1/images/I/71MweK4Q3rL._AC_UL320_.jpg,3.3,4899
595,Garuda Photos - Sri Rama Pattabhishekam Photo Frame; Ram; Rama; Ramar; Sri; Sree; Shri; Shree; Shreeram; Shriram; Sreeram;...,https://m.media-amazon.com/images/W/IMAGERENDERING_521856-T1/images/I/91CFDT46arL._AC_UL320_.jpg,4.5,4800
596,Pure Indian Candle Handpourd Citronella and Camphor Scented Green Tea Light Candle PICTC25002 (Pack of 25 Pcs.),https://m.media-amazon.com/images/W/IMAGERENDERING_521856-T1/images/I/71gsk141+GS._AC_UL320_.jpg,3.8,4849
597,COCODOR Basic Scented Reed Diffuser 100ml / Lavender Blue,https://m.media-amazon.com/images/W/IMAGERENDERING_521856-T1/images/I/51u7ENttxUL._AC_UL320_.jpg,4.2,"48,500"
598,"Mr.Doctor Bathroom Freshener Fragrance Blocks, Pack of 12, Air Freshener for Toilet, Bathroom, Washroom, Shoe rack. MiX Fr...",https://m.media-amazon.com/images/W/IMAGERENDERING_521856-T1/images/I/81V93AyUDcL._AC_UL320_.jpg,3.9,4800
599,"Windup Fridge Magnet Photo Frame Set (Wave) - 12 Frames per Set - 4 PC 9X6in, 4 PC6.25X4.25 in, 4 PC 4.5X2.5in - Made in I...",https://m.media-amazon.com/images/W/IMAGERENDERING_521856-T1/images/I/81reWBfFlsL._AC_UL320_.jpg,4,4899
600,GN 1917 Non-Charcoal Maahi Javadhu sambrani Cups for Pooja | Combo Pack of 2 BoXes | Long Lasting Fragrance | Javadhu Infu...,https://m.media-amazon.com/images/W/IMAGERENDERING_521856-T1/images/I/71Ko9f8UhFL._AC_UL320_.jpg,3.9,4840
601,Rangoli New Beautiful Peacock & Flower Vase Painting to Dcor your Living Spaces Digital Reprint 18 inch X 12 inch,https://m.media-amazon.com/images/I/616oE144EqL._AC_UL320_.jpg,4.2,4899
602,"KOTART Paintings Set of 4 Framed Paintings for Wall Decoration, Bedroom - Framed Wall Posters/Paintings for Living Room wi...",https://m.media-amazon.com/images/I/71tZMgo-2KL._AC_UL320_.jpg,4.4,"48,999"
603,"DARMIKA Pyramid Meditation Cap for Daily Meditation for Students , Plastic",https://m.media-amazon.com/images/I/41kC2KP9+bL._AC_UL320_.jpg,4.2,4899
604,"CraftVatika Adiyogi Shiva Idol Statue for Car Dashboard Small, Adiyogi Statue for Home, Tabletop, OfficeDesk",https://m.media-amazon.com/images/I/61ttMehnrpL._AC_UL320_.jpg,5,4899
605,Gifts Culture Paintings Set of 3 Framed Paintings - Framed Wall Posters - Big Size Wall Painting( 20X40 inch ) Multicolor,https://m.media-amazon.com/images/I/61x+Bpqa62L._AC_UL320_.jpg,3.3,"48,899"
606,ProXoto Positive Motivational Quotes Designer Wooden Wall Hanging for Home| Office| Institute|Kitchen|Living Room|Gifts|Wa...,https://m.media-amazon.com/images/I/51YxJjG2EuL._AC_UL320_.jpg,4.4,4899
607,Collectible India Ganesha Shubh Labh Metal Toran for diwali / Toran for door latest Fancy / toran for pooja room Mandir / ...,https://m.media-amazon.com/images/I/81v4-rr3b0L._AC_UL320_.jpg,4.1,4899
608,Ancient Shoppee Wooden 1 Glass Test Tube Home Decor Planter Modern Flower Vase with Wood Stand Plant Propagation,https://m.media-amazon.com/images/I/41FtQ8Qg43L._AC_UL320_.jpg,4.2,4899
609,"Teak Wood Beautiful MDF Wooden Temple/Pooja Mandir for Home and Office/Wall Mounted Temple/Puja Stand (Brown, Height-46, L...",https://m.media-amazon.com/images/I/71z+1RM2DmL._AC_UL320_.jpg,4.2,"48,199"
610,LUXURY DECORATIVE EYE Wooden Beautiful Temple with Led Light Already Assembled Drawer Spacious Multicolor,https://m.media-amazon.com/images/I/71+0+soUlZL._AC_UL320_.jpg,3.7,
611,"JAIPUR ACE Happiness Sign Marble Monk Showpieces Best for Gifting Special and Loved Ones for Home Dcor & Office, Table- S...",https://m.media-amazon.com/images/I/91kXOxS1dJS._AC_UL320_.jpg,4.1,"48,499"
612,"Rangoli Vinyl Vehicles Wall Sticker 1.96 X 20.86 X 1.96 Inches, Multicolour (Model Number: White Glossy Vinyl-0050), Autom...",https://m.media-amazon.com/images/I/61ILLkBmyYL._AC_UL320_.jpg,4.4,4899
613,Foto Factory Gifts Personalized Caricature Gifts for Lady Dentist Doctor (wooden_8 inch X 5 inch) CA0234,https://m.media-amazon.com/images/I/61OwRefp1rL._AC_UL320_.jpg,4.2,4899
614,i Creations Personalised Black Matte Nameplate with Golden Acrylic Solid Letters (8 X 12 Inch),https://m.media-amazon.com/images/I/81Cya05C+RL._AC_UL320_.jpg,4.4,"48,500"
615,Nilgiri Aromas Eucalyptus Natural Pure And Undiluted Essential Oil 60 ML,https://m.media-amazon.com/images/I/813kXThBcPL._AC_UL320_.jpg,5,4840
616,"Zest 4 Toyz Non-ToXic Perfumed Herbal Gulal for Holi Celebration, Skin Friendly, Natural Fragrance Handmade Holi Gulal-Pac...",https://m.media-amazon.com/images/I/81aFg1iXgQL._AC_UL320_.jpg,4.1,4899
617,"Art Street Set of 5 White Photo Frame With This Is Us MDF Cutout for Home Dcor Living Room Wall Decoration (Size - 5X7, 6...",https://m.media-amazon.com/images/I/613zJG3rz+L._AC_UL320_.jpg,4.6,"48,000"
618,Brothers Creation Please Leave Your Shoes and Sliiper Outside Wooden Shoes Hanging for Home Door,https://m.media-amazon.com/images/I/81HUxgAmfqL._AC_UL320_.jpg,3.8,4869
619,"Good Hope - Ronaldo CR7 Poster for Room & Office (13 Inch X 19 Inch, Rolled, Sports, Multicolour)",https://m.media-amazon.com/images/I/71siE7G3W6L._AC_UL320_.jpg,4.5,4850
620,Balaji Rose - Pure Rose Sticks - 25 Incense Sticks,https://m.media-amazon.com/images/I/81CGmzyWmpL._AC_UL320_.jpg,4.2,4880
621,"ZULU Antique Anchor Pendulam Wall Clock for Living Room Dcor Battery Operated Analog Clock for Classroom, Bedroom, Kitche...",https://m.media-amazon.com/images/I/51ospYjO+cL._AC_UL320_.jpg,3.9,"48,199"
622,"SATYAM KRAFT Golden Decorative Net Potli Pouch Basket, Lotus For Multipurpose Use, Traditional Royal Gifting (Pack of 12)...",https://m.media-amazon.com/images/I/61gsVFiv08L._AC_UL320_.jpg,3.8,"48,200"
623,MAGNETICKS 1 Pieces of 50mm X 25mm X 10mm House-Hold & Industrial Magnet,https://m.media-amazon.com/images/I/31r79vWkZwL._AC_UL320_.jpg,4.1,"48,399"
624,"WAVE TRADERS Metal Nautical Brass Telescope with Wooden BoX, Toys for Children (6 inch, Gold and Black)",https://m.media-amazon.com/images/I/71Fn4XTXUDL._AC_UL320_.jpg,3.5,4899
625,"11Delights White Sage Dhoop Sticks.(4inch Long, 220 Grams). No Bamboo | No Charcoal | Incense | Pooja | Puja Dhup Batti | ...",https://m.media-amazon.com/images/I/41uu65x-k-L._AC_UL320_.jpg,4.4,
626,"KARTMEN Vintage Travel Posters, Self Adhesive, Easy Peel and Stick,Retro Landscape/Popular City Posters for Wall Poster (9...",https://m.media-amazon.com/images/I/61M6Y2HKCAL._AC_UL320_.jpg,4.5,"48,299"
627,Ikea Metal Decoration Elephant Figurine (Gold) -Set of 2,https://m.media-amazon.com/images/I/61C7pvBYMDL._AC_UL320_.jpg,4.5,"48,199"
628,"ADRIAN Wall Clock | Wall Clock for Home | 12"" Silent Quartz Decorative Wall Clock Non-Ticking Classic Digital Clock Batter...",https://m.media-amazon.com/images/I/412EV7ncwqL._AC_UL320_.jpg,3.7,"48,299"
629,"GMT 15X3mm Silver disc Shaped Ceramic Magnet for Fridge, Arts, Crafts, DIY Hobby Projects, Office & School Use - 15 pcs",https://m.media-amazon.com/images/I/41NxK2QuB3L._AC_UL320_.jpg,4.4,4899
630,"Two Moustaches Gemstone Work Brass Urli Ethnic Traditional Bowl with Bells, Gemstone Work, Material - Brass, Pack of 1",https://m.media-amazon.com/images/I/71aoqM6UEjL._AC_UL320_.jpg,4.2,"48,990"
631,Pure Source India Ceramic Electric Aroma Diffuser Matka Shape Oil Burner with Bulb (Blue - with 10 ml Lavender Aroma Oil),https://m.media-amazon.com/images/I/71V22HbFL+L._AC_UL320_.jpg,3.5,4899
632,"Kitlyn Ram Darbar Statue God Ram, Sita, LaXman & Hanuman Idol for Spiritual Puja Vastu & Gift Item - 21 cm (Polyresin, Mul...",https://m.media-amazon.com/images/I/71am8Y8H4-L._AC_UL320_.jpg,4.1,"48,499"
633,"Special You 3D Butterfly for Decoration items for Wall Sticker with Sticking Pad for Home Decoration, Removable Stickers H...",https://m.media-amazon.com/images/I/71eb9KjqgRL._AC_UL320_.jpg,3,"48,399"
634,LABHCART Metal Decorative Bowl Urli Table Accents for Decoration | Urli Bowl for Home Decor | Gift Item Table Decorative S...,https://m.media-amazon.com/images/I/611QrpFUiJL._AC_UL320_.jpg,5,4899
635,"URBOII Designer Wooden Wall Hangings Home Decor Items evil eye turkish evil eye Boho Hamsa Hand for Home, Office, House P...",https://m.media-amazon.com/images/I/71LFNsDknaL._AC_UL320_.jpg,4.5,4899
636,Mount Acrylic DIY Frameless 3D Mirror Sticker Large Wall Clock for Home & Office Decorations (Black),https://m.media-amazon.com/images/I/51SFZ0G+gfL._AC_UL320_.jpg,4.3,4899
637,"HINMIN Smart Night Light Plastic Digital Alarm Clock with Date & Indoor Temperature, Battery Operated Desk Small, Clear LC...",https://m.media-amazon.com/images/I/61uYG4ACLoS._AC_UL320_.jpg,3.8,"48,599"
638,"VILASA Aromatheraphy Diffuser Oil for Home & Office Use, Aroma Diffuser, Easy Usage, No Mineral Oil Valley of Flowers",https://m.media-amazon.com/images/I/61i8kMs52oL._AC_UL320_.jpg,5,4825
639,"Bikri Kendra - Stars 50 Golden Decorative Mirror Stickers for Wall, Wall Mirror Stickers, 3D Acrylic Stickers Wall Sticker...",https://m.media-amazon.com/images/I/619bZzfq8OL._AC_UL320_.jpg,3.9,"48,199"
640,Little Buddha Monk Solar Head Shaking | Car Home Decoration Figurine Statue Toys,https://m.media-amazon.com/images/I/51GNhLJHTmL._AC_UL320_.jpg,4.2,4899
641,Harbour Analog Latest Stylish New Models Wall Clock for Home Living Room Hall Bedroom (Size Height 48 CM X Width 41 CM) Mz...,https://m.media-amazon.com/images/I/919JKNfy91L._AC_UL320_.jpg,3.9,"48,599"
642,Koshtak Kamdhenu Cow with Brahma Vishnu Mahesh/Shiva Giving Blessing Laminated Poster with Synthetic Wood Golden Frame (30...,https://m.media-amazon.com/images/I/A1rwMxNAsTL._AC_UL320_.jpg,4.5,4899
643,PRINTELLIGENT Wall Art Vintage Wooden Wall Hanging Home Decor Items. (ART) (style-b),https://m.media-amazon.com/images/I/71BZFfXEOKL._AC_UL320_.jpg,3.9,4899
644,"Brightown 25FT Black Wire : 25Ft G40 Globe String Lights with Clear Bulbs, ul listed Backyard Patio Lights, Hanging Indoo...",https://m.media-amazon.com/images/I/61ekV91t9qL._AC_UL320_.jpg,3.1,"48,999"
645,"Paper Cute Babies / Children Poster, Multicolour, Medium",https://m.media-amazon.com/images/I/61HwaOiy1sS._AC_UL320_.jpg,4.4,4850
646,A F Decor Hanging Murracan Lantern/Tealight Holder with Tealight Candle Hanging Light for Indoor|Outdoor Home Dcor Pack o...,https://m.media-amazon.com/images/I/61ZjEcOM98L._AC_UL320_.jpg,4.2,4800
647,Party 24X7 Birthday Party Decoration Star Candle Gold Big Cake Decoration Candles Golden Theme Candle (Gold),https://m.media-amazon.com/images/I/61WNVx2TabL._AC_UL320_.jpg,5,4899
648,"STAR WORK Wall Clock - Silent Non-Ticking Wall Clocks Battery Operated - Modern Style Wooden Clock Decorative for Kitchen,...",https://m.media-amazon.com/images/I/41qyjeY-yGL._AC_UL320_.jpg,4,4899
649,ADA Handicraft Premium Lord Goddess God Shankar Family Photo for Pooja | Hindu Bhagwan Devi Devta Shiva Parvati Photo | Go...,https://m.media-amazon.com/images/I/A1zMRVMHHLL._AC_UL320_.jpg,4.4,"48,499"
650,S2S Lord Ganesh with Gaumata Backdrop Curatin Cloth for Pooja Decoration/House Warming Function/Traditional Events 8 Ft Wi...,https://m.media-amazon.com/images/I/71U6ZybSOpL._AC_UL320_.jpg,5,"48,199"
651,Rinkon Stockmarket Poster Trading Candlestick Patterns Chart For Traders Stock market Chart Bullish Bearish Sharemarket Tr...,https://m.media-amazon.com/images/I/81VkdlogAEL._AC_UL320_.jpg,4.2,"48,499"
652,"Remedywala Vastu Brass Strip, 8 feet Length, 18mm Width, 0.2 mm Gauge, Gold Color, 1 Piece",https://m.media-amazon.com/images/I/71wRjAu-EKL._AC_UL320_.jpg,4.3,4899
653,"Saifee Burhani Wood MFD Masha Allah Islamic Religious Wall and Door Frame (30cmX10cm, Golden, Brown)",https://m.media-amazon.com/images/I/71yCHFjNzML._AC_UL320_.jpg,4.4,4899
654,"Wall1ders Kalash Shubh Labh Mirror Stickers for Wall, Acrylic Mirror Wall Decor Sticker, Wall Mirror Stickers, Acrylic Sti...",https://m.media-amazon.com/images/I/61EUCpU8DnL._AC_UL320_.jpg,4,4899
655,BoXania  20 pieces Safe Natural Camphor Wood Balls Moth Balls Bug Mildew Repellent Wardrobe Clothes Drawers Pest Control,https://m.media-amazon.com/images/I/31eDUbS+kkL._AC_UL320_.jpg,3.3,4849
656,"Pure Source India Dry Flower Scented Potpourri - 100 Gm, Lavender, Blue",https://m.media-amazon.com/images/I/919uWaYjNPL._AC_UL320_.jpg,3.8,4851
657,Krishi Sai Baba Murti Marble Dust Idol Statue for Pooja (White_4.5 Inch),https://m.media-amazon.com/images/I/41RZxaGFnQL._AC_UL320_.jpg,4,4899
