Rank,Name,image,Ratings,Price
265,"Gypsy Sandalwood Air Freshener Sachets ?Pack of 10 Perfume Sachet - 10 Grams Each|Fresh Fragrance for Your Wardrobe, Cupb...",https://m.media-amazon.com/images/W/IMAGERENDERING_521856-T1/images/I/81P3ZTMSeqL._AC_UL320_.jpg,4.1,4850
266,"Artvibes Motivational Quote Wall Hanger for Home|Office|Living Room|Gift, Wall Decoration (WH_4406N)",https://m.media-amazon.com/images/W/IMAGERENDERING_521856-T1/images/I/81hRlfjIAjL._AC_UL320_.jpg,4.5,4899
267,"Pure Source India Ceramic Electric Oil Diffuser, with Lemon Grass, 1 Piece, Off-White",https://m.media-amazon.com/images/W/IMAGERENDERING_521856-T1/images/I/71ywCPjYMZL._AC_UL320_.jpg,3.1,4899
268,"Auromin Stylish Wooden Wall Clock for Home Decor, Unique Design Modern Big Size Wall Watch for Living Room, Bedroom, Offic...",https://m.media-amazon.com/images/W/IMAGERENDERING_521856-T1/images/I/515-+MJKNwL._AC_UL320_.jpg,4,"48,499"
269,King International Stainless Steel Silver Table Top 3 Side Cut Ash Tray Large 12 cm,https://m.media-amazon.com/images/W/IMAGERENDERING_521856-T1/images/I/41R25JZPFSL._AC_UL320_.jpg,4.3,4899
270,Artvibes Cooking Quotes Designer Wooden Wall Hanging for Home Decor | Gifts | Wall Decoration Items for Kitchen | Decorati...,https://m.media-amazon.com/images/W/IMAGERENDERING_521856-T1/images/I/61IoA5hppcL._AC_UL320_.jpg,4,4899
271,"Stuthi Arts Brown Decorative Wall Mirror Decorative Mirror (Rectangle) Size- 13.4 in. X 10 in (Rectangular,Framed)",https://m.media-amazon.com/images/W/IMAGERENDERING_521856-T1/images/I/61lCbxQ86HL._AC_UL320_.jpg,5,"48,199"
272,Rangoli Design PVC Stickers Waterproof Laminated Wall Stickers Stylish Kitchen Art 70or50 cm Size Pack of 1,https://m.media-amazon.com/images/W/IMAGERENDERING_521856-T1/images/I/61Z6xo3rD+L._AC_UL320_.jpg,2.9,4899
273,"Art Street Set of 2 Table Photo Frames, Tabletop Picture Frames for Office & Home - 4X6 Inchs- White",https://m.media-amazon.com/images/W/IMAGERENDERING_521856-T1/images/I/617E2XkHKlL._AC_UL320_.jpg,3.7,"48,299"
274,TIED RIBBONS Birthday Wedding Anniversary Gift for Girlfriend Boyfriend Wife Husband Him Her - Special (Heart Shape Teddy ...,https://m.media-amazon.com/images/W/IMAGERENDERING_521856-T1/images/I/81RENfrRayL._AC_UL320_.jpg,3.7,4899
275,"PRINTNET Pack of 77 BTS Band Members Photocards collection, HD+ Quality, Multicolour, (4.4 X 3 Inch)",https://m.media-amazon.com/images/W/IMAGERENDERING_521856-T1/images/I/91eaVQaL2nL._AC_UL320_.jpg,4.5,4899
276,"Parag Fragrances 5 in 1 Real Dhoop Sticks 250gm (Sandalwood, Rose, Amber, Guggal and Aqua) ",https://m.media-amazon.com/images/W/IMAGERENDERING_521856-T1/images/I/914gFveoYML._AC_UL320_.jpg,4.3,4800
277,Art Street Decorative Wall Mirror Block Design Brown Set of 3 Square Shape Mirror for Home Decoration & Wall Decoration- S...,https://m.media-amazon.com/images/W/IMAGERENDERING_521856-T1/images/I/61Ubn8ffxBL._AC_UL320_.jpg,4.2,"48,600"
278,"PAPERI Hanging Artificial Plant With Plastic Pot For Indoor/Outdoor Home Decor (Green,Pack Of 1)",https://m.media-amazon.com/images/W/IMAGERENDERING_521856-T1/images/I/71apoElAjAL._AC_UL320_.jpg,4.2,4850
279,"SWASUM Superhero's Motivational and Inspirational Quotes Wall Posters, (Iron Man, Batman, Dead Pool, Superman, Spiderman, ...",https://m.media-amazon.com/images/W/IMAGERENDERING_521856-T1/images/I/71AK5zDd5wL._AC_UL320_.jpg,4.2,4899
280,TIED RIBBONS Lord Shiva Statue Figurine Blessing Idol Sculpture Murti Decorative for Home Bedroom Pooja Room Office Table ...,https://m.media-amazon.com/images/W/IMAGERENDERING_521856-T1/images/I/81pBGy38txL._AC_UL320_.jpg,4.3,"48,899"
281,BeautifulWalls Artificial Wall Grass for Home Decoration (1 Pc) I Grass Mat for Wall I Vertical Garden Artificial Wall Pla...,https://m.media-amazon.com/images/W/IMAGERENDERING_521856-T1/images/I/61RI7BPyRMS._AC_UL320_.jpg,4.1,4837
282,"SAPPHIRE INDIA Retro Style Twin Bell Alarm Clock with Classic Tick-Tock Sound, Night Light, and Battery Operation, Black",https://m.media-amazon.com/images/W/IMAGERENDERING_521856-T1/images/I/61XQ+mI40oL._AC_UL320_.jpg,4.3,"48,299"
283,Stuthi Arts Wall Wood Photo Frames White-A4-(4),https://m.media-amazon.com/images/W/IMAGERENDERING_521856-T1/images/I/51CiW9t8yOL._AC_UL320_.jpg,2.9,4899
284,"ILU  Feathers Dream Catcher with Lights, Wall Hangings, Crafts, Home Decor, Handmade for Bedroom, Balcony, Garden, Party,...",https://m.media-amazon.com/images/W/IMAGERENDERING_521856-T1/images/I/81W24OwY5pS._AC_UL320_.jpg,4.2,4899
285,"ACS MART vastu pyramid for home positive energy plastic white 4.5"" 91 Pyramid (81+9+1)",https://m.media-amazon.com/images/W/IMAGERENDERING_521856-T1/images/I/213jeZ0l09L._AC_UL320_.jpg,4.2,4899
286,Naayaab Craft Pakka Sheesham Wood Agarbatti Incense Stick BoX And Dhoop Stand Ash Catcher Decorative Handicraft Incense Ho...,https://m.media-amazon.com/images/W/IMAGERENDERING_521856-T1/images/I/61xKzqPE3lL._AC_UL320_.jpg,4.2,4899
287,"ToyKraft GelWaX Candle Making, DIY Candle Making Kit for Kids, Art and Craft Activity Kit for 8 Years to Adults ( Pack of 1)",https://m.media-amazon.com/images/W/IMAGERENDERING_521856-T1/images/I/61Ka+lJfUjL._AC_UL320_.jpg,3.8,4849
288,Vridhi Enterprises Ferrite Ring Magnet/Ceramic Magnet with 17.5mm O.D. X 7.5mm I.D. X 3mm Thickness with 1 Ns Coin- 40 Pcs,https://m.media-amazon.com/images/W/IMAGERENDERING_521856-T1/images/I/21E3SEcqhkL._AC_UL320_.jpg,4,4800
289,"Colossal Art House Leaf Framed Poster Large Wall Painting for Living Room, Bedroom and Office Wall Decoration Frame (13X17...",https://m.media-amazon.com/images/W/IMAGERENDERING_521856-T1/images/I/617UIoaTrsS._AC_UL320_.jpg,4.1,4899
290,Chocozone Couple Hug Resin Showpiece Couple Miniatures Romantic Gifts for Girlfriend (Hug & Propose Combo) Multicolor,https://m.media-amazon.com/images/W/IMAGERENDERING_521856-T1/images/I/91HJRCO8hVL._AC_UL320_.jpg,4,4899
291,"Seven Chakra Crystals and Gemstones, Seven Chakra Crystal Tree Showpiece for Good Luck Home Decor Item Bonsai Money Tree P...",https://m.media-amazon.com/images/W/IMAGERENDERING_521856-T1/images/I/71RTfCc8U7L._AC_UL320_.jpg,5,"48,450"
292,"PILIFE Loud Alarm Clock,4 inches Non-Ticking Analog Twin Bell Alarm Clock with Backlight,No Snooze,Battery Operated for He...",https://m.media-amazon.com/images/W/IMAGERENDERING_521856-T1/images/I/71XjImp7IjL._AC_UL320_.jpg,4.3,4899
293,"Craft Village Personalised name trunk (10X7X3.5) (Baby Pink) engineered wood, Rectangular",https://m.media-amazon.com/images/W/IMAGERENDERING_521856-T1/images/I/81IV69DYgJL._AC_UL320_.jpg,4.4,"48,574"
294,Collectible India Diwali Diya Crystal Round Akhand Diya for Puja Brass Small Kamal Deep Jyoti Oil Lamp for Home Temple Poo...,https://m.media-amazon.com/images/W/IMAGERENDERING_521856-T1/images/I/71lflIcyL+S._AC_UL320_.jpg,4,"48,999"
295,"Artizen Essential Oils (Lavender Flavour) Pure Essential Oils Set for Diffuser, Humidifier, Massage, Aromatherapy (30ML. P...",https://m.media-amazon.com/images/W/IMAGERENDERING_521856-T1/images/I/71teU001CSL._AC_UL320_.jpg,4.5,4875
296,Pure Source India Natural Wood Bote Shape Incense Holder and Ash Catcher (11 X 3 Inch),https://m.media-amazon.com/images/W/IMAGERENDERING_521856-T1/images/I/619VovwN-BL._AC_UL320_.jpg,4.5,4851
297,Trophies TMW for Student Collage Institute Events Award Trophy Gift Home and Office Decoration,https://m.media-amazon.com/images/W/IMAGERENDERING_521856-T1/images/I/71dqkQw6rRS._AC_UL320_.jpg,3.2,4800
298,Herbal Strategi ?NatureSpray Lavender | Room Freshener |Lavender Aromatic Fragrance | Disinfectant | Completely Herbal |E...,https://m.media-amazon.com/images/W/IMAGERENDERING_521856-T1/images/I/41CxBxSVr2L._AC_UL320_.jpg,4.1,4822
299,Aarushi Creations Wood Personalised Home Door Name Plate Wooden with Golden Acrylic Embossed Letters with Mirror Shine (Si...,https://m.media-amazon.com/images/W/IMAGERENDERING_521856-T1/images/I/911ftY+CdzL._AC_UL320_.jpg,4.3,"48,800"
300,"pranjals house Metallic Brass Surya Dev Home Decor, Designer Wall Hanging Decoration Sculpture for Living Room| Bedroom| H...",https://m.media-amazon.com/images/W/IMAGERENDERING_521856-T1/images/I/81LKOx+PwrL._AC_UL320_.jpg,4.2,4899
301,"Aromahpure Scented Candles (75 hours) (100% Natural WaX )- Handcrafted | Smoke-Free | Joyful lavender, Citrus Grove, Earth...",https://m.media-amazon.com/images/W/IMAGERENDERING_521856-T1/images/I/81Zmp8gIhfL._AC_UL320_.jpg,4.1,4819
302,Atulya Arts Offering- 100 Pieces (3 cm Each) Square Mirrors Golden Wall Stickers 3D Acrylic Sticker Decorative Stickers fo...,https://m.media-amazon.com/images/W/IMAGERENDERING_521856-T1/images/I/51mNNWcBH3L._AC_UL320_.jpg,3.9,4899
303,S2S Mango Leaves and Flowers Decoration at Home | Easy Simple Backdrop Pack of 12 Pcs (Yellow Flowers),https://m.media-amazon.com/images/W/IMAGERENDERING_521856-T1/images/I/71Xb7B+rs7L._AC_UL320_.jpg,4.2,4899
304,Tusmad HTC-2 Plastic Digital Indoor Cum Outdoor Thermo-hygrometer with Temperature Humidity Meter Tester Multiprose (White),https://m.media-amazon.com/images/W/IMAGERENDERING_521856-T1/images/I/510xbgZW8HL._AC_UL320_.jpg,Get,"48,299"
305,"Rangoli Vinyl Modern Art Wall Sticker 1.96 X 20.86 X 1.96 Inches, Multicolour (Model Number: Modern Art472),",https://m.media-amazon.com/images/W/IMAGERENDERING_521856-T1/images/I/61NJjillgZL._AC_UL320_.jpg,4.1,4899
306,"VITARA Handicraft Wooden Open Rectangular Incense Stick /Agarbatti Holder Stand/Ash Collector Ideal for Home,Office,Templ...",https://m.media-amazon.com/images/W/IMAGERENDERING_521856-T1/images/I/51RQn+VC4US._AC_UL320_.jpg,3.9,4899
307,"RJKART Polyresin Handcrafted Cute Child Monk Showpiece Laughing Baby Buddha Set of 1, Multicolor",https://m.media-amazon.com/images/W/IMAGERENDERING_521856-T1/images/I/71me4wHcHHL._AC_UL320_.jpg,4.3,"48,599"
308,"LADECOR Sunboard Religious Split Panel Painting, Multicolor, Printed, 27 X 50 inches",https://m.media-amazon.com/images/W/IMAGERENDERING_521856-T1/images/I/71HvnvGmlML._AC_UL320_.jpg,4.6,"48,900"
309,"Rangoli Making Tools Kit Set of 12 Rangoli Color Powder Bottle Rangoli Making Stencil Set of 3 Rangoli Fillers Stamp, Fill...",https://m.media-amazon.com/images/W/IMAGERENDERING_521856-T1/images/I/61oTtaiY98L._AC_UL320_.jpg,3.5,4899
310,"Painting Mantra Floral & Bird Framed Painting / Posters for Room Decoration , Set of 4 Black Frame Art Prints / Posters fo...",https://m.media-amazon.com/images/W/IMAGERENDERING_521856-T1/images/I/71KL7MSuglL._AC_UL320_.jpg,4,"48,500"
311,"BS AMOR Dream Catcher Car Hanging White~ Handmade Hanging Wall Hangings, Garden, Car, Outdoor, Bedroom Pack of 1",https://m.media-amazon.com/images/W/IMAGERENDERING_521856-T1/images/I/61DqpZBi5ZL._AC_UL320_.jpg,3.4,4899
312,Jelly Bubbles / Water Jelly Beads Soil Jelly Water Balls Magic Crystal Rubber Jelly Beads 100 Grams,https://m.media-amazon.com/images/W/IMAGERENDERING_521856-T1/images/I/71wl+dA-aVL._AC_UL320_.jpg,4,4899
313,"eCraftIndia 'Golden Bal Gopal Krishna Having Makhan' Decorative Showpiece (Metal, 8 cm X 9 cm, Golden, AGK507)",https://m.media-amazon.com/images/I/71PZHLOiUIL._AC_UL320_.jpg,4.2,"48,499"
314,Indianara 3 Piece Set of Framed Wall Hanging Welcome Home Decor Art (1193) Prints 8.7 inch X 8.7 inch Without Glass-Multic...,https://m.media-amazon.com/images/I/91BTtBo240L._AC_UL320_.jpg,4.4,"48,200"
315,"CSN - CUTE SHOPPING NETWORK Natraj Series Photo Album with EXtra Clear PVC Film 200 Photos, (Photo Size Supported: 4X6 Inc...",https://m.media-amazon.com/images/I/61bOngqbfUL._AC_UL320_.jpg,4.5,4899
316,"ARTISKRITI Evil Eye Hanging for Home Entrance House Door Decoration, Hamsa Hand Nazar Battu for Home Protection, Good Luck...",https://m.media-amazon.com/images/I/71iRMw6Ca4L._AC_UL320_.jpg,5,"48,495"
317,"Homesoul Beautiful Plastic Flower Vase for Decoration of Your Home Decorate & Office Room, Pair of 2 (PT-03) Pastel Green",https://m.media-amazon.com/images/I/51m81jQudqL._AC_UL320_.jpg,4.4,4899
318,BS AMOR Fancy Artificial Flowers Bouquet Home Wedding Decoration 'Living Room' Dining Table Decor Vase Bunch Vibrant Color...,https://m.media-amazon.com/images/I/71Abl9RjfpL._AC_UL320_.jpg,3.8,4899
319,Rangoli Large Wall Sticker Multicolor Vinyl 50 or 70 CM Pack of 1,https://m.media-amazon.com/images/I/71f3HeTCWUL._AC_UL320_.jpg,4.1,4899
320,"HOMELOOK-Garden and Outdoor Incense Sticks Citronella, Lemongrass 20 Mosquito Repellent 16 Inch Long and 10mm Thick Pure C...",https://m.media-amazon.com/images/I/71MozpBkA0L._AC_UL320_.jpg,3.8,4899
321,"International Gift Silver Finish LaXmi Ganesh Sarswati God Idol With Beautiful Velvet BoX EXclusive Gift For Diwali, Corpo...",https://m.media-amazon.com/images/I/71BXcuY1gOL._AC_UL320_.jpg,4.4,"48,400"
322,A&S Ventures Smoke Fountain Lord Shiva Adiyogi Statue Cone Incense Holder Showpiece with 10 Free Smoke Backflow for Templ...,https://m.media-amazon.com/images/I/4171v3KtuML._AC_UL320_.jpg,4.2,4899
323,"R Enterprise Vastu Poster'' 7 Horses Running River beautiful Wall poster, Wall Painting, Home Decor, Office Decor Art (12 ...",https://m.media-amazon.com/images/I/61jhVf5wOcL._AC_UL320_.jpg,5,4899
324,"999STORE Lord Buddha Painting Blessing with flowers nature with Frame for Living Room buddha wall painting (76X130 cms, Go...",https://m.media-amazon.com/images/I/71IlM9CRfSS._AC_UL320_.jpg,4,"48,999"
325,"LWVAX Artificial Flower Plants Dracaena Potted Plant with Black Pot Fake Bonsai Flower for Home, Office, Indoor and Outdoo...",https://m.media-amazon.com/images/I/51H7-56s+2L._AC_UL320_.jpg,4.9,"48,899"
326,"Decordial lippan Art Materials DIY kit with 2 Round MDF Board (1 pcs lippan Art Clay, 2 pcs lippan Art Board, lippan Art M...",https://m.media-amazon.com/images/I/8102r23AKPL._AC_UL320_.jpg,4.2,"48,999"
327,SPHINX Artificial Marigold Fluffy Flowers with Bell and Tuberoses (Rajnigandha) Clustered Garlands Strings for Festive Poo...,https://m.media-amazon.com/images/I/61cMAwFuKPL._AC_UL320_.jpg,4.2,"48,299"
328,"La Jarden Aum printed on silky satin fabric in Saffron (kesariya), Orange color flag for Yoga, Meditation, Om shanti bhaw...",https://m.media-amazon.com/images/I/71ywC4MU7EL._AC_UL320_.jpg,4.4,4889
329,"JK International Himalaya Erina Ep 450ml Fragrance Lemon, orange",https://m.media-amazon.com/images/I/31YAEUWFZhL._AC_UL320_.jpg,4.5,4845
330,SPHINX Artificial Jasmine Buds & Rose Strings for Decoration ApproX 2.5 ft/30 Inches (Off White) - Number of Strings- (6),https://m.media-amazon.com/images/I/91C8rTlvfGL._AC_UL320_.jpg,4.2,4899
331,"Tej Gifts Stone Nandi Idol, Handcrafted Matt Finish Shiva's Cow Statue for Temple Puja/Home, Nandi Pindi Showpiece, Ideal ...",https://m.media-amazon.com/images/I/518rET+hocL._AC_UL320_.jpg,4.5,4899
332,"UAPAN Brass Hanging Bells (Shubh_Labh, Gold)",https://m.media-amazon.com/images/I/51rVs+Ww+9L._AC_UL320_.jpg,4.3,4899
333,god & god's Large Wall Sticker JUST Peel & Stick Size 50 or 60 cm Pack of 1 (Code GS183,https://m.media-amazon.com/images/I/61FXMSfwiXL._AC_UL320_.jpg,5,4899
334,"Sheer Veda Clove Essential Oil 100% Pure, Natural and Undiluted for Skin, Hair and teeth (15 ML)",https://m.media-amazon.com/images/I/61cF1Oh-XiL._AC_UL320_.jpg,4,4809
335,Plus Value Wealth Abundance Reiki Healing Crystal Bag for Prosperity Vastu Feng Shui (Multicolour),https://m.media-amazon.com/images/I/51v9sAMDYPL._AC_UL320_.jpg,4.1,"48,500"
336,"Angel Bear Vinyl Waterproof Wall Stickers (7cm by 4cm) - 108 Pieces, White",https://m.media-amazon.com/images/I/71jPMJFdjwL._AC_UL320_.jpg,4.3,4899
337,Wallstick Buddha with Quotes wallstickers (Vinyl 110 cm X 100 cm),https://m.media-amazon.com/images/I/61wa65t9bPL._AC_UL320_.jpg,4.1,4899
338,Divya Mantra Feng Shui Chinese Lucky Fortune I-Ching Dragon Coin Ornaments Wealth Charm Amulet Three Bronze Metal Coins wi...,https://m.media-amazon.com/images/I/61GIN1tLocL._AC_UL320_.jpg,4.4,4800
339,"OVEERA Twin Bell Copper Table Alarm Clock with Night LED Light for Student for Kids Bedroom, Wall Mounte (Copper)",https://m.media-amazon.com/images/I/61ZKHU5ySEL._AC_UL320_.jpg,3.9,4899
340,Jaamso Royals Large Elegant Flower Graceful Peach Blossom Birds PVC Vinyl Home Decor Wall Stickers Wall Sticker (90 CM X 6...,https://m.media-amazon.com/images/I/71h6I7nNiZL._AC_UL320_.jpg,3.8,4899
341,"MANSAA USB String Lights for Decoration 5 MTR 50 LED USB Operated, Yellow Rice Light, Lights for Diwali Decoration, Diwal...",https://m.media-amazon.com/images/I/816sU9Ry8DL._AC_UL320_.jpg,4.1,4898
342,"Indianara Set of 3 Deers Art MDF Art Painting (4064FL) without glass 4.5 X 12, 9 X 12, 4.5 X 12 INCH(Multicolor4064FL)",https://m.media-amazon.com/images/I/81QqvCa7GwL._AC_UL320_.jpg,3.3,4899
343,DS ENTERPRISE Kapur Dani Electrical Camphor Diffuser. Glass Kapoor Dani & Essential Oil Diffuser with On Off Switch to Tog...,https://m.media-amazon.com/images/I/51BoU+jLVbL._AC_UL320_.jpg,2.6,4899
344,"TIED RIBBONS Resin Krishna Idol, Standard, Multicolour, 1 Piece",https://m.media-amazon.com/images/I/81SpZ2Fx4yL._AC_UL320_.jpg,4.3,4899
345,SAF Ram Darbar Framed Acrylic Glass Painting 14 inch X 11 inch SANFR12(Multicolor),https://m.media-amazon.com/images/I/81T-s0XjdUL._AC_UL320_.jpg,4.1,4899
346,"PUNZONE Self Adhesive Unbeakable Oval Shape Mirror Sticker For Dcor Wall Kitchen, Bathroom, Bedroom, Living Room and Dini...",https://m.media-amazon.com/images/I/31fDQIdm8YL._AC_UL320_.jpg,4.2,4819
347,"Genson Novelty Enterprises Artificial Rose Orchid Flowers Bunch For Home Wall Hanging (Pink, 1)(1.)",https://m.media-amazon.com/images/I/71TxkXC9oqL._AC_UL320_.jpg,3.7,"48,249"
348,"Chalk My Theme Bless This Kitchen Quote Chop Board Wooden Wall Art for Kitchen, Cafe, Restaurant, Dining Table | Kitchen D...",https://m.media-amazon.com/images/I/51Wand6QVmL._AC_UL320_.jpg,4.6,4899
349,Airwick Automatic Air Freshener with Refill 250ml White Flowers,https://m.media-amazon.com/images/I/71j0rpe1FCL._AC_UL320_.jpg,4.3,4849
350,PAPER PLANE DESIGN Quote and Motivational Posters 12X18 (Poster-A),https://m.media-amazon.com/images/I/81a8WFX72LL._AC_UL320_.jpg,4.2,4895
351,"Decals Creation Vinyl Flowers Switch Board Fridge Wall Sticker, 23.62 X 29.92 X 0.39 Inches, Multicolour, Botanical",https://m.media-amazon.com/images/I/71JO5kw6zaL._AC_UL320_.jpg,3.9,4849
352,Collectible India Tealight Candle Holder Metal Wall Hanging Wall Art Sconce for Home Living Room Dcor /Christmas Decorati...,https://m.media-amazon.com/images/I/714k0XZesEL._AC_UL320_.jpg,4.2,4899
353,"Apka Mart The Online Shop Lord Ganesh Dancing Pose Metal Wall Hanging, Bronze color, 18 Inch Height - for Wall Decor, Home...",https://m.media-amazon.com/images/I/610gVX0b5PL._AC_UL320_.jpg,4.4,"48,800"
354,"Home Genie Unscented, Smokeless, Dripless, Long Burn Time, Paraffin WaX Tealight Candles for Home Dcor, Diwali Diya, Birt...",https://m.media-amazon.com/images/I/71YnRWKfAPL._AC_UL320_.jpg,4.1,4884
355,"EXpleasia Ganesha Idol with Wooden Temple for Home mandir, Temple, car Dashboard Temple, Gift Items (Ganesha Temple 2)",https://m.media-amazon.com/images/I/51Vc7ND1gKL._AC_UL320_.jpg,4.1,4850
356,Ajanta Wall Clock 14 Inches Vintage Sweep Wall Clock(No TIK TIK),https://m.media-amazon.com/images/I/71LVXmWUQ9L._AC_UL320_.jpg,4.2,4895
357,"Decals Design 5785 StickersKart PVC Vinyl Wall Stickers Hanging Lamp and Vines Black, 70cm X 50cm (Multicolour)",https://m.media-amazon.com/images/I/51PHyceH5TL._AC_UL320_.jpg,4.2,4864
358,"natureCRAFTS Natural Wood Agarbatti Incense Holder and Ash Catcher for Home ,Wooden Incense Tray for Sticks, Mango Wood St...",https://m.media-amazon.com/images/I/61J8GnOUnoL._AC_UL320_.jpg,4.1,4899
359,"Diya Shape Flower Decorative Urli Bowl for Home Handcrafted Bowl for Floating Flowers and Tea Light Candles Home ,Office a...",https://m.media-amazon.com/images/I/61Yza-iUAGL._AC_UL320_.jpg,4.2,"48,299"
360,Kajal Dream Cool Multicolor Printed 32 inches LED TV Cover (PVC) fit For All Brands Every Models P-04,https://m.media-amazon.com/images/I/71k2MrhJ-9L._AC_UL320_.jpg,3.8,4899
361,Wallstick Buddha with Quotes wallstickers (Vinyl 110 cm X 100 cm),https://m.media-amazon.com/images/W/IMAGERENDERING_521856-T2/images/I/61wa65t9bPL._AC_UL320_.jpg,4.1,4899
362,"OVEERA Twin Bell Copper Table Alarm Clock with Night LED Light for Student for Kids Bedroom, Wall Mounte (Copper)",https://m.media-amazon.com/images/W/IMAGERENDERING_521856-T2/images/I/61ZKHU5ySEL._AC_UL320_.jpg,3.9,4899
363,Jaamso Royals Large Elegant Flower Graceful Peach Blossom Birds PVC Vinyl Home Decor Wall Stickers Wall Sticker (90 CM X 6...,https://m.media-amazon.com/images/W/IMAGERENDERING_521856-T2/images/I/71h6I7nNiZL._AC_UL320_.jpg,3.8,4899
364,"MANSAA USB String Lights for Decoration 5 MTR 50 LED USB Operated, Yellow Rice Light, Lights for Diwali Decoration, Diwal...",https://m.media-amazon.com/images/W/IMAGERENDERING_521856-T2/images/I/816sU9Ry8DL._AC_UL320_.jpg,4.1,4898
365,"Indianara Set of 3 Deers Art MDF Art Painting (4064FL) without glass 4.5 X 12, 9 X 12, 4.5 X 12 INCH(Multicolor4064FL)",https://m.media-amazon.com/images/W/IMAGERENDERING_521856-T2/images/I/81QqvCa7GwL._AC_UL320_.jpg,3.3,4899
366,DS ENTERPRISE Kapur Dani Electrical Camphor Diffuser. Glass Kapoor Dani & Essential Oil Diffuser with On Off Switch to Tog...,https://m.media-amazon.com/images/W/IMAGERENDERING_521856-T2/images/I/51BoU+jLVbL._AC_UL320_.jpg,2.6,4899
367,"TIED RIBBONS Resin Krishna Idol, Standard, Multicolour, 1 Piece",https://m.media-amazon.com/images/W/IMAGERENDERING_521856-T2/images/I/81SpZ2Fx4yL._AC_UL320_.jpg,4.3,4899
368,SAF Ram Darbar Framed Acrylic Glass Painting 14 inch X 11 inch SANFR12(Multicolor),https://m.media-amazon.com/images/W/IMAGERENDERING_521856-T2/images/I/81T-s0XjdUL._AC_UL320_.jpg,4.1,4899
369,"PUNZONE Self Adhesive Unbeakable Oval Shape Mirror Sticker For Dcor Wall Kitchen, Bathroom, Bedroom, Living Room and Dini...",https://m.media-amazon.com/images/W/IMAGERENDERING_521856-T2/images/I/31fDQIdm8YL._AC_UL320_.jpg,4.2,4819
370,"Genson Novelty Enterprises Artificial Rose Orchid Flowers Bunch For Home Wall Hanging (Pink, 1)(1.)",https://m.media-amazon.com/images/W/IMAGERENDERING_521856-T2/images/I/71TxkXC9oqL._AC_UL320_.jpg,3.7,"48,249"
371,"Chalk My Theme Bless This Kitchen Quote Chop Board Wooden Wall Art for Kitchen, Cafe, Restaurant, Dining Table | Kitchen D...",https://m.media-amazon.com/images/W/IMAGERENDERING_521856-T2/images/I/51Wand6QVmL._AC_UL320_.jpg,4.6,4899
372,Airwick Automatic Air Freshener with Refill 250ml White Flowers,https://m.media-amazon.com/images/W/IMAGERENDERING_521856-T2/images/I/71j0rpe1FCL._AC_UL320_.jpg,4.3,4849
373,PAPER PLANE DESIGN Quote and Motivational Posters 12X18 (Poster-A),https://m.media-amazon.com/images/W/IMAGERENDERING_521856-T2/images/I/81a8WFX72LL._AC_UL320_.jpg,4.2,4895
374,"Decals Creation Vinyl Flowers Switch Board Fridge Wall Sticker, 23.62 X 29.92 X 0.39 Inches, Multicolour, Botanical",https://m.media-amazon.com/images/W/IMAGERENDERING_521856-T2/images/I/71JO5kw6zaL._AC_UL320_.jpg,3.9,4849
375,Collectible India Tealight Candle Holder Metal Wall Hanging Wall Art Sconce for Home Living Room Dcor /Christmas Decorati...,https://m.media-amazon.com/images/W/IMAGERENDERING_521856-T2/images/I/714k0XZesEL._AC_UL320_.jpg,4.2,4899
376,"Apka Mart The Online Shop Lord Ganesh Dancing Pose Metal Wall Hanging, Bronze color, 18 Inch Height - for Wall Decor, Home...",https://m.media-amazon.com/images/W/IMAGERENDERING_521856-T2/images/I/610gVX0b5PL._AC_UL320_.jpg,4.4,"48,800"
377,"Home Genie Unscented, Smokeless, Dripless, Long Burn Time, Paraffin WaX Tealight Candles for Home Dcor, Diwali Diya, Birt...",https://m.media-amazon.com/images/W/IMAGERENDERING_521856-T2/images/I/71YnRWKfAPL._AC_UL320_.jpg,4.1,4884
378,"EXpleasia Ganesha Idol with Wooden Temple for Home mandir, Temple, car Dashboard Temple, Gift Items (Ganesha Temple 2)",https://m.media-amazon.com/images/W/IMAGERENDERING_521856-T2/images/I/51Vc7ND1gKL._AC_UL320_.jpg,4.1,4850
379,Ajanta Wall Clock 14 Inches Vintage Sweep Wall Clock(No TIK TIK),https://m.media-amazon.com/images/W/IMAGERENDERING_521856-T2/images/I/71LVXmWUQ9L._AC_UL320_.jpg,4.2,4895
380,"Decals Design 5785 StickersKart PVC Vinyl Wall Stickers Hanging Lamp and Vines Black, 70cm X 50cm (Multicolour)",https://m.media-amazon.com/images/W/IMAGERENDERING_521856-T2/images/I/51PHyceH5TL._AC_UL320_.jpg,4.2,4864
381,SATYAM KRAFT Dream Catcher Moon Handmade Cotton Dori Dream Catcher Wall Hanging with LED Light for Home and Room Decoratio...,https://m.media-amazon.com/images/W/IMAGERENDERING_521856-T2/images/I/613smh1GUmL._AC_UL320_.jpg,3.7,"48,200"
382,"natureCRAFTS Natural Wood Agarbatti Incense Holder and Ash Catcher for Home ,Wooden Incense Tray for Sticks, Mango Wood St...",https://m.media-amazon.com/images/W/IMAGERENDERING_521856-T2/images/I/61J8GnOUnoL._AC_UL320_.jpg,4.1,4899
383,"Diya Shape Flower Decorative Urli Bowl for Home Handcrafted Bowl for Floating Flowers and Tea Light Candles Home ,Office a...",https://m.media-amazon.com/images/W/IMAGERENDERING_521856-T2/images/I/61Yza-iUAGL._AC_UL320_.jpg,4.2,"48,299"
384,Kajal Dream Cool Multicolor Printed 32 inches LED TV Cover (PVC) fit For All Brands Every Models P-04,https://m.media-amazon.com/images/W/IMAGERENDERING_521856-T2/images/I/71k2MrhJ-9L._AC_UL320_.jpg,3.8,4899
385,Newven 1 Feet Handcrafted Krishna murti showpiece Idol Decorative Statue Figurine for Home Decor Craft Gifts for House War...,https://m.media-amazon.com/images/I/6132aSftqbL._AC_UL320_.jpg,5,"48,100"
386,EFINITO Wall Art - Tree of Life - Family Tree Wooden Wall Decor Home Office Decoration Bedroom Living Room Dcor,https://m.media-amazon.com/images/I/619eoeAOERL._AC_UL320_.jpg,3,"48,499"
387,NIRMALAYA TULSI Incense Sticks Agarbatti | 100% Natural and Charcoal Free | Incense Sticks for Pooja | Incense Sticks for ...,https://m.media-amazon.com/images/I/41ggMn3ud7L._AC_UL320_.jpg,2.2,4850
388,Natali Traders Shiv Ji Murti Car Dashboard Statue Cold Brass Bronze for Home Dcor & Puja Room-Mahadev- Tridev - Baba Bhol...,https://m.media-amazon.com/images/I/71oPYS3HFLL._AC_UL320_.jpg,4.4,4899
