Rank,Name,image,Ratings,Price
925,"Risty Shop High Definition one Piece Luffy Zoro Nami Usopp Sanji Superhero Jujutsu Manga Anime Poster -Designer Merch,matt...",https://m.media-amazon.com/images/W/IMAGERENDERING_521856-T1/images/I/81lcB9f1wrL._AC_UL320_.jpg,3.6,4899
926,"PriyadrshanPriyadrshanPanchamukhi Hanuman Wall Sticker Main Door Vastu Dosh Rectification Remedy of Home, Office, with EXt...",https://m.media-amazon.com/images/W/IMAGERENDERING_521856-T1/images/I/71HmyykwhaL._AC_UL320_.jpg,3.9,4894
927,"Giant Innovative Craft Qila Paper Santa Claus Twins Smiling Baby Poster (Multicolor, 12 X 18 Inch)",https://m.media-amazon.com/images/W/IMAGERENDERING_521856-T1/images/I/81g8a51wvIL._AC_UL320_.jpg,4,4859
928,"Wall1ders - Lotus Flower Mirror Stickers for Wall, Acrylic Mirror Wall Decor Sticker, Wall Sticker for Hall Room, Living R...",https://m.media-amazon.com/images/W/IMAGERENDERING_521856-T1/images/I/61Q9FtE+BbL._AC_UL320_.jpg,5,4899
929,TRP The Rolling Paper Unbleached 64 Pre-Rolled Cones 100% Pure Unbleached Wood Pulp Papers Brown,https://m.media-amazon.com/images/W/IMAGERENDERING_521856-T1/images/I/71ePh0UijIL._AC_UL320_.jpg,4.2,4840
930,NoWorries Floral & Pop art Framed poster for wall decor/Wall paintings with frame Engineered Wood Frame ( 11 inch X 14 inc...,https://m.media-amazon.com/images/W/IMAGERENDERING_521856-T1/images/I/51w0JRlhEFL._AC_UL320_.jpg,4.2,"48,999"
931,"Amazon Brand - Solimo 12-inch Plastic & Glass Wall Clock - Aqua Toon (Silent Movement), Black",https://m.media-amazon.com/images/W/IMAGERENDERING_521856-T1/images/I/711ZqDk+v0L._AC_UL320_.jpg,4.1,"48,100"
932,Home Decorative Hour Glass Sand Timer 5 Minutes Sand Timer Wooden And Brass Sand Timer For Kitchen Hour Glass Sandglass Cl...,https://m.media-amazon.com/images/W/IMAGERENDERING_521856-T1/images/I/81rHdRdRlcS._AC_UL320_.jpg,4,4899
933,VEEDAA Bulgarian Lavender Mason Tin Soy WaX Scented Candle (Burns 25 Hours),https://m.media-amazon.com/images/W/IMAGERENDERING_521856-T1/images/I/91KkhWSwcdL._AC_UL320_.jpg,4.5,4800
934,INTERNATIONAL GIFT Golden Peacock Shape Jesus Symbol 12 cm Car Dashboard Idol Christian Religious Showpiece and Home Deco...,https://m.media-amazon.com/images/W/IMAGERENDERING_521856-T1/images/I/71H594Cq4gL._AC_UL320_.jpg,3.7,"48,800"
935,Asian Hobby Crafts Dream Catcher Wall Hanging : Size (LXB) 45X15 cm : ' Odyssey',https://m.media-amazon.com/images/W/IMAGERENDERING_521856-T1/images/I/61i2k3GWJgL._AC_UL320_.jpg,4.2,4800
936,eCraftIndia Enlightening Sai Baba Matt TeXtured Framed Synthetic Wood UV Art Painting (35.6 cm X 1.3 cm X 50.8 cm),https://m.media-amazon.com/images/W/IMAGERENDERING_521856-T1/images/I/61LCducCOcL._AC_UL320_.jpg,4.3,"48,469"
937,Shah Fragrances Meditation Combo Zipper Packs Incense Sticks (Pack of 6)(710 GMS),https://m.media-amazon.com/images/W/IMAGERENDERING_521856-T2/images/I/71-ZrETkUqL._AC_UL320_.jpg,4.2,4850
938,"LuXaar Quality Gold Number Candles, Birthday Cake Candles, 5.3 inches Gold Number Cupcake Candle, Birthday Wedding Anniver...",https://m.media-amazon.com/images/W/IMAGERENDERING_521856-T2/images/I/41IrhWnodHL._AC_UL320_.jpg,4.7,4899
939,3A Featuretail Decorative Paper Fan Set for Birthday/Anniversary/Baby Shower/Backdrop Decoration and Paper Fan Craft (Set ...,https://m.media-amazon.com/images/W/IMAGERENDERING_521856-T2/images/I/519n8xOVmWL._AC_UL320_.jpg,3.7,4899
940,"Simran Handicrafts Satyam Crafts Wrought Iron Wall Bracket (18 X 2 X 20cm, Gold)",https://m.media-amazon.com/images/W/IMAGERENDERING_521856-T2/images/I/51h4r6ktrJL._AC_UL320_.jpg,4.2,4899
941,"BHOOLU&GOOLU Plastic Mini Panda Showpiece, Small, Multicolour, 4 Piece",https://m.media-amazon.com/images/W/IMAGERENDERING_521856-T2/images/I/41xa3FoFT5L._AC_UL320_.jpg,3.9,4899
942,iDream Self-Adhesive MiX Disney Princess Stickers Snow White Frozen Cartoon Theme DIY Stickers for Suitcase Laptop Bicycle...,https://m.media-amazon.com/images/W/IMAGERENDERING_521856-T2/images/I/71E82lA7FEL._AC_UL320_.jpg,3.7,4899
943,Minimal Affairs Chanderi Fabric Designer Cash BoX for wedding return gift shagun money boX - Red,https://m.media-amazon.com/images/W/IMAGERENDERING_521856-T2/images/I/71sFnyOlWBL._AC_UL320_.jpg,5,4899
944,Vertical Root Inc Reusable Handmade Colourful Diyas Decoration Items- Set of 4,https://m.media-amazon.com/images/W/IMAGERENDERING_521856-T2/images/I/91BxRYeQ-7L._AC_UL320_.jpg,3.9,4895
945,"Inephos Bruce Lee As You Think Quote Poster Art , Grey, 300 GSM Paper, 12 X 18 inch",https://m.media-amazon.com/images/W/IMAGERENDERING_521856-T2/images/I/61JYsQwqllL._AC_UL320_.jpg,4.4,4899
946,Parag Fragrances Mogra Dhoop Sticks / Dhoop Batti Grade-1 Jar (Pack of 1 X 200Gm) Long Lasting Perfume for 24 Hours Home F...,https://m.media-amazon.com/images/W/IMAGERENDERING_521856-T2/images/I/814DCnvjblL._AC_UL320_.jpg,3.6,4899
947,Godrej aer Musk After Smoke Home Air Freshener Spray (300 ml) - Pack of 2,https://m.media-amazon.com/images/W/IMAGERENDERING_521856-T2/images/I/31+Wny9qHtL._AC_UL320_.jpg,4.2,4838
948,HIMMUKHI Back Flow Incense Holder shivling Incense Burner with 40 | Back Flow Incense Cones Dropping Smoke Fountain Backfl...,https://m.media-amazon.com/images/W/IMAGERENDERING_521856-T2/images/I/51YHQPceClL._AC_UL320_.jpg,4.2,4845
949,World Fire Austin Round Hammered Traditional Potpourri Bowl Handcrafted Metallic Gold (12 inch),https://m.media-amazon.com/images/W/IMAGERENDERING_521856-T2/images/I/61KgE04xsaL._AC_UL320_.jpg,4.2,4899
950,Marble Lord Bholenath Shiv Shiva Idol Statue for Pooja & Gift Mahadev Mahakal Ji Murti Idol Lord Adiyogi Shankara for Home...,https://m.media-amazon.com/images/W/IMAGERENDERING_521856-T2/images/I/61JpsxhGiEL._AC_UL320_.jpg,1,4899
951,"Kuber Industries 6 Piece Indivisual Photo Frames Set For Home & Office Decoration (Black) Size: 4X6-3 Pc, 5X7-3 Pc, wood, ...",https://m.media-amazon.com/images/W/IMAGERENDERING_521856-T2/images/I/61E87zIFO4L._AC_UL320_.jpg,3.8,"48,499"
952,"VAS Collection Home Floral MDF Wall Decoration Panel, Wall Decoration Hanging, Wood Carving Wall Decoration Panel for Livi...",https://m.media-amazon.com/images/W/IMAGERENDERING_521856-T2/images/I/81RB4bFx-aL._AC_UL320_.jpg,4.1,"48,499"
953,"AuraDecor Scented Tealight Candles, Pure WaX 20 Pcs (Lavender)",https://m.media-amazon.com/images/W/IMAGERENDERING_521856-T2/images/I/71QpuE+iEZL._AC_UL320_.jpg,3.4,4898
954,"Mr.Doctor Naphthalene Colourfull Balls 400 Gram for Cloth Store,Insecticide,Pantry, Bugs and Moths, Repellant, Scented Sme...",https://m.media-amazon.com/images/W/IMAGERENDERING_521856-T2/images/I/819YXi09P4L._AC_UL320_.jpg,3.5,4899
955,"Magpie Document Bag Recycled Plastic and Fabric Woollen Pom Pom Door Hanging Torans, Wall Hangings Latkans for Decoration...",https://m.media-amazon.com/images/W/IMAGERENDERING_521856-T2/images/I/41EFFe+QfjL._AC_UL320_.jpg,4,4850
956,L B LB Sales Wood Triangle Shape Dhoop Batti Stand/Temple Wooden Charcoal/Cone Burner Wooden Incense Holder (Brown)(Conica...,https://m.media-amazon.com/images/W/IMAGERENDERING_521856-T2/images/I/416UgRl0IDS._AC_UL320_.jpg,3.6,4880
957,Rangoli Print Deer MDF Wood Reprint Painting for Home Decoration Unique 12 inch or 18 inch Each Size Painting Set of 3 Mul...,https://m.media-amazon.com/images/W/IMAGERENDERING_521856-T2/images/I/61VH16HAO2L._AC_UL320_.jpg,4.7,4899
958,"90 Degree 3 pcs Wall Mounted Stick Agarbatti Stand Holder Wall Sticky Agarbatti Stand Holder, Hook for puja, Metal, 4.5L X...",https://m.media-amazon.com/images/W/IMAGERENDERING_521856-T2/images/I/71b9+ahUM0L._AC_UL320_.jpg,4.1,4800
959,Mangaldeep Temple - Lord Vishnu's Favourite Fragrances - 140 sticks (pack of 4),https://m.media-amazon.com/images/W/IMAGERENDERING_521856-T2/images/I/61xQZnCWuXL._AC_UL320_.jpg,4.7,4800
960,Koya's Agarbathi Maya Supreme Sambrani Powder (50+15gm) (Pack of 12),https://m.media-amazon.com/images/W/IMAGERENDERING_521856-T2/images/I/61GzWrFxYFL._AC_UL320_.jpg,4.5,4810
961,"Parag Fragrances Real Dhoop Sticks 250gm Collection No. 2 (Khus, Mogra, Gulab, Agaroud and Sandalwood) for Meditation, Pra...",https://m.media-amazon.com/images/W/IMAGERENDERING_521856-T2/images/I/51KgaFMHxJL._AC_UL320_.jpg,4.3,4899
962,AuraDecor Pack of 50 Fragrance Tealight Candles || Spa Candles || 3 Hours Burning Time (Jasmine),https://m.media-amazon.com/images/W/IMAGERENDERING_521856-T2/images/I/61-pqekoC9L._AC_UL320_.jpg,3.7,"48,299"
963,"SIA VENDORSPlain Kitchen Stickers Wall Oil Proof Peel & Stick for Kitchen Tiles Behind Gas Stoves, Sink, Wash Basin, Sti...",https://m.media-amazon.com/images/W/IMAGERENDERING_521856-T2/images/I/41skQwONyxL._AC_UL320_.jpg,3.5,4899
964,"SheetKart Landscape Tapestries - Aesthetic Bohemian Wall Hanging Tapestry for Bed Room Home Decor, Pack of 2, Beige",https://m.media-amazon.com/images/W/IMAGERENDERING_521856-T2/images/I/817ItGTj3hS._AC_UL320_.jpg,4.6,4899
965,"Photojaanic ""Wanna Grow Old with You"" unique quotes Matte Finish magnet set for fridge (3.5 X 3.5 inch, Multicolor )",https://m.media-amazon.com/images/W/IMAGERENDERING_521856-T2/images/I/612AA+UKjUL._AC_UL320_.jpg,4.6,4899
966,CAPIO ART Wooden Peacock Handprinted Antique Wall Clock for Home Wall Decor Round Handmade Vintage Wall Clock for Study Ro...,https://m.media-amazon.com/images/W/IMAGERENDERING_521856-T2/images/I/71Zw9pHmrML._AC_UL320_.jpg,4.7,4899
967,Two Moustaches Brass Ethnic Twin Peacock Design Wall Hanging Diya with Bell (Yellow_4 Inch X 3 Inch X 7.5 Inch),https://m.media-amazon.com/images/W/IMAGERENDERING_521856-T2/images/I/81sQrZAvDML._AC_UL320_.jpg,4.4,"48,990"
968,"Kios Digital Smart Backlight Battery Operated Alarm Table Clock with Automatic Sensor, Date & Temperature (White, Pack of 1)",https://m.media-amazon.com/images/W/IMAGERENDERING_521856-T2/images/I/616u1ssoxIL._AC_UL320_.jpg,3.5,4899
969,"Incredible Gifts India Personalized Beech-wood Photo Plaque Best Retirement for Father, Mother, Boss (7X5 inches, Brown) ,...",https://m.media-amazon.com/images/W/IMAGERENDERING_521856-T2/images/I/71OeHwa0DML._AC_UL320_.jpg,4.4,"48,950"
970,Sidak Golden Camel Showpiece for Home Decor Wealth and Gifting (Pack of 1Pc),https://m.media-amazon.com/images/W/IMAGERENDERING_521856-T2/images/I/71JKp794XRL._AC_UL320_.jpg,4.2,4850
971,"FLIPSSHOPPEE Drink Coasters, Wooden Coasters with Iron Holder, Great for Hot and Cold Drinks Beer Coffee, Tea and Wine Uni...",https://m.media-amazon.com/images/W/IMAGERENDERING_521856-T2/images/I/41ka-E0ZypL._AC_UL320_.jpg,4.8,4899
972,"OHM Premium Cigarette Filter Tubes (King Size, Red), Pack of (1)",https://m.media-amazon.com/images/W/IMAGERENDERING_521856-T2/images/I/51LA+oyasBL._AC_UL320_.jpg,3.8,4800
973,"DecorTwist Brass Superfine Square Traditional Lotus Engraved 3 CM High Brass Pooja Chowki, Chowki for God Idols, Temple De...",https://m.media-amazon.com/images/W/IMAGERENDERING_521856-T2/images/I/41xizVbj8CL._AC_UL320_.jpg,3.5,"48,249"
974,"Prosperro Lumo Paraffin waX candles , tea light set of 50, 3 hr",https://m.media-amazon.com/images/W/IMAGERENDERING_521856-T2/images/I/51AMcHRldxL._AC_UL320_.jpg,4.2,4899
975,"Risty Shop High Definition one Piece Luffy Zoro Nami Usopp Sanji Superhero Jujutsu Manga Anime Poster -Designer Merch,matt...",https://m.media-amazon.com/images/W/IMAGERENDERING_521856-T2/images/I/81lcB9f1wrL._AC_UL320_.jpg,3.6,4899
976,"Giant Innovative Craft Qila Paper Santa Claus Twins Smiling Baby Poster (Multicolor, 12 X 18 Inch)",https://m.media-amazon.com/images/W/IMAGERENDERING_521856-T2/images/I/81g8a51wvIL._AC_UL320_.jpg,4,4859
977,"Wall1ders - Lotus Flower Mirror Stickers for Wall, Acrylic Mirror Wall Decor Sticker, Wall Sticker for Hall Room, Living R...",https://m.media-amazon.com/images/W/IMAGERENDERING_521856-T2/images/I/61Q9FtE+BbL._AC_UL320_.jpg,5,4899
978,TRP The Rolling Paper Unbleached 64 Pre-Rolled Cones 100% Pure Unbleached Wood Pulp Papers Brown,https://m.media-amazon.com/images/W/IMAGERENDERING_521856-T2/images/I/71ePh0UijIL._AC_UL320_.jpg,4.2,4840
979,Sprqcart Water Floating Smokeless Candles & Lotus Flowers Sensor Led Tea Light Unbreakable for Outdoor and Indoor Festival...,https://m.media-amazon.com/images/W/IMAGERENDERING_521856-T2/images/I/714Mvv2lqrL._AC_UL320_.jpg,4.5,4899
980,NoWorries Floral & Pop art Framed poster for wall decor/Wall paintings with frame Engineered Wood Frame ( 11 inch X 14 inc...,https://m.media-amazon.com/images/W/IMAGERENDERING_521856-T2/images/I/51w0JRlhEFL._AC_UL320_.jpg,4.2,"48,999"
981,"Amazon Brand - Solimo 12-inch Plastic & Glass Wall Clock - Aqua Toon (Silent Movement), Black",https://m.media-amazon.com/images/W/IMAGERENDERING_521856-T2/images/I/711ZqDk+v0L._AC_UL320_.jpg,4.1,"48,100"
982,Home Decorative Hour Glass Sand Timer 5 Minutes Sand Timer Wooden And Brass Sand Timer For Kitchen Hour Glass Sandglass Cl...,https://m.media-amazon.com/images/W/IMAGERENDERING_521856-T2/images/I/81rHdRdRlcS._AC_UL320_.jpg,4,4899
983,INTERNATIONAL GIFT Golden Peacock Shape Jesus Symbol 12 cm Car Dashboard Idol Christian Religious Showpiece and Home Deco...,https://m.media-amazon.com/images/W/IMAGERENDERING_521856-T2/images/I/71H594Cq4gL._AC_UL320_.jpg,3.7,"48,800"
984,Asian Hobby Crafts Dream Catcher Wall Hanging : Size (LXB) 45X15 cm : ' Odyssey',https://m.media-amazon.com/images/W/IMAGERENDERING_521856-T2/images/I/61i2k3GWJgL._AC_UL320_.jpg,4.2,4800
985,"Door toran Natural Paddy (Golden)/3 feet toran for Main Door and for Pooja Room,36 inches toran,92 Centimeter. (T102)",https://m.media-amazon.com/images/W/IMAGERENDERING_521856-T1/images/I/61g58RD3A-S._AC_UL320_.jpg,4.1,4899
986,Gmall WaX Nugget Floating Candles (White) - Pack of 25,https://m.media-amazon.com/images/W/IMAGERENDERING_521856-T1/images/I/5173J-XFiwL._AC_UL320_.jpg,3.8,4860
987,"SoulAbiti One Piece straw hat pirates wanted poster Luffy Gear 5 ( Pack of 10, 12 X 18 inches )Multicolor",https://m.media-amazon.com/images/W/IMAGERENDERING_521856-T1/images/I/71FsiXV+ALL._AC_UL320_.jpg,4.3,"48,499"
988,Sri Sai Flora Buy from 'JM_Traders' only FluXo Incense Sticks - Pack of 20 pouches of 25 grams each - Total 500 grams + 1 ...,https://m.media-amazon.com/images/W/IMAGERENDERING_521856-T1/images/I/71Y8VsehGXL._AC_UL320_.jpg,4.6,4800
989,"Collectible India Metal Lord Ganesh Idol, 6.5 X 5 X 2.5 Inches, Golden (Model Number: GBS211)",https://m.media-amazon.com/images/W/IMAGERENDERING_521856-T1/images/I/81KP7qc4wUL._AC_UL320_.jpg,4.1,4899
990,"KOTART Aesthetic Modern Art Wall Paintings with Frame for Living Room Bedroom Office Wall Decoration ( 11 X 14 inch, Multi...",https://m.media-amazon.com/images/W/IMAGERENDERING_521856-T1/images/I/71Y2JsJJQKL._AC_UL320_.jpg,4.2,"48,999"
991,Dukhni Oud Bakhoor Incense Variety BoX (20 Pieces) & Rainbow EXotic Bakhoor Burner - Gift Set & Starter Kit. Perfect for N...,https://m.media-amazon.com/images/W/IMAGERENDERING_521856-T1/images/I/91sAiLY3jWL._AC_UL320_.jpg,4,4880
992,"SupvoX Magnetic Clips, 10 Pcs Strong Refrigerator Magnetic Hook Clips with Anti-Scratch Sticky Pads Included, Fridge Free...",https://m.media-amazon.com/images/W/IMAGERENDERING_521856-T1/images/I/71kdRMWvtDL._AC_UL320_.jpg,3.5,4841
993,"Oreva Plastic Wooden Look Small Size Designer Wall Clock (22.5 X 22.5 X 4 cm, Wood, AQ-7587A)",https://m.media-amazon.com/images/W/IMAGERENDERING_521856-T1/images/I/61hpI1Wl8QL._AC_UL320_.jpg,3.8,4825
994,"DT DECTONE Lucky Big Hamsa Hand and Horseshoe Evil Eye Hanging for Car, Home Entrance Door Decoration, House Door Decorati...",https://m.media-amazon.com/images/W/IMAGERENDERING_521856-T1/images/I/515kQbuNluL._AC_UL320_.jpg,5,"48,250"
995,"Sanvatsar Home Decorative Diya Set of 6 | Corporate Gift, Diwali Gift Diya,Deepak, Candles, New Year Gift, Christmas Gift...",https://m.media-amazon.com/images/W/IMAGERENDERING_521856-T1/images/I/81m-Dr4z0RL._AC_UL320_.jpg,4.3,4899
996,Pmw - Khas Khas Grass - Camel Grass - Vatti Veru - Usira - Vettiver Grass Roots - 100 Grams - Loose Packed,https://m.media-amazon.com/images/W/IMAGERENDERING_521856-T1/images/I/81bJ+RpqZFL._AC_UL320_.jpg,4.2,4899
997,VK HORE Artificial Garlands Hanging Leaves Greenery Vine Creeper Plan Contains 30 Leaves -Each String 7.2 ft (Pack of 3 St...,https://m.media-amazon.com/images/W/IMAGERENDERING_521856-T1/images/I/51eU-Y6trVL._AC_UL320_.jpg,4,4899
998,"Geetanjali Handcrafted Wooden Classic Premium Design Antique Finish Wall Clock - (Gold, 14"" X 14"") 10",https://m.media-amazon.com/images/W/IMAGERENDERING_521856-T1/images/I/81s0eugl71L._AC_UL320_.jpg,3,"48,000"
999,Kartique Brass Shiva Parvati - Shiv Parivar Bholenath Shankar Ganesh Family Murti Idol Statue Sculpture Height 6 Inches (...,https://m.media-amazon.com/images/W/IMAGERENDERING_521856-T1/images/I/81tMZ2d1QuL._AC_UL320_.jpg,4.6,"48,550"
1000,Personalized Gifts Polaroid Photo Prints customized (Pack Of 50),https://m.media-amazon.com/images/W/IMAGERENDERING_521856-T1/images/I/71WMHIZQA-L._AC_UL320_.jpg,4.8,4899
1001,"Wolpin Wall Stickers Botanical Wallpaper (60 X 300 cm) Living Room, Bedroom, TeXtured Embossed Peony Roses Decal Floral Ho...",https://m.media-amazon.com/images/W/IMAGERENDERING_521856-T1/images/I/81xKDzvrVgL._AC_UL320_.jpg,4.1,"48,499"
1002,Collectible India Goddess Lakshmi Idol Hindu LaXmi Statue Home Office Decor (Size 8cm X 5cm),https://m.media-amazon.com/images/W/IMAGERENDERING_521856-T1/images/I/61HSYyMlhTL._AC_UL320_.jpg,4.1,"48,999"
1003,"DreamKraft 6 Inch Paper Mache Elephant Showpiece (16X14 cm ,Red)",https://m.media-amazon.com/images/W/IMAGERENDERING_521856-T1/images/I/51l1bk+PvkL._AC_UL320_.jpg,4.2,4800
1004,"KARTMEN 300GSM Thick Paper, Gloss Laminated HD Smiling Cute Baby Combo Posters for Pregnant Women - Set of 20 (12X18-Inche...",https://m.media-amazon.com/images/W/IMAGERENDERING_521856-T1/images/I/81Kq91qCjLL._AC_UL320_.jpg,4.2,"48,499"
1005,AUTOEASY Tirupati Balaji idol for Car Dashboard murti Tirupati Balaji idol for home Spiritual Gift Item & Statue for Bhagw...,https://m.media-amazon.com/images/W/IMAGERENDERING_521856-T1/images/I/71KfdlJBozL._AC_UL320_.jpg,4.8,4850
1006,CLAWCRAFTS SRI Yantra Mandala Wall Decor - EXperience Harmony and Prosperity with this EXquisite 12 X 12 Inches Art Piece ...,https://m.media-amazon.com/images/W/IMAGERENDERING_521856-T1/images/I/81n8u6OG4sL._AC_UL320_.jpg,4.2,"48,999"
1007,VG Hookah Gel Tube ( 100% Herbals ) Frozen Brain Flavour Get a Complementary American Phunnel Chillam 33021010,https://m.media-amazon.com/images/W/IMAGERENDERING_521856-T1/images/I/61VMXAiXySL._AC_UL320_.jpg,4.2,4850
1008,Collectible India Metal LaXmi Ganesh Idol Set - Gold Plated Lakshmi Ganesha Idols Statue for Diwali Decoration Home Office...,https://m.media-amazon.com/images/W/IMAGERENDERING_521856-T1/images/I/71Pv5vhoqYL._AC_UL320_.jpg,4.2,4899
1009,"Local Kala's Ceramic Milk jug vase/Eggshell vase to Keep Pampas Grass, Flowers, fillers for centerpieces, Side Table and H...",https://m.media-amazon.com/images/I/81n8zCaUKFL._AC_UL320_.jpg,5,4899
1010,"KYARA ARTS Big Size Multiple Frames, Beautiful Wall Art Painting for Living Room, Bedroom, Office, Hotels, Drawing Room Wo...",https://m.media-amazon.com/images/I/912JXyOztzL._AC_UL320_.jpg,4.7,"48,500"
1011,"NISHAN Singapuri Loban Sambrani Dhoop Cups, 24 Pcs BoX with Holder Plate, Lohban dhup Cup",https://m.media-amazon.com/images/I/61P3ca-V0cL._AC_UL320_.jpg,4.1,4898
1012,"Generic Panchmukhi Hanuman Vahan Durghatana Nasak Pocket Yantra in Card - for Temple Home Purse, Multicolour, Standard (Ha...",https://m.media-amazon.com/images/I/91U56nC7NxL._AC_UL320_.jpg,4.2,4812
1013,"VPK MDF Wood Analog Round Wall Clock Small Size 10 Inch, 25 X 25 cm Wenge-21",https://m.media-amazon.com/images/I/81FNp72m81L._AC_UL320_.jpg,4,"48,499"
1014,"Wolpin Wall Sticker Kids Wallpaper (60 X 300 cm) Kids Room Alphabets Design, Blue",https://m.media-amazon.com/images/I/61FLD2lnnYL._AC_UL320_.jpg,3.7,"48,499"
1015,Auroshikha Incense Sticks Combo - Set of 19,https://m.media-amazon.com/images/I/71BHBOzJNHL._AC_UL320_.jpg,4.4,4822
1016,"Ramesh_Traders Dimond Colour(2 Horses 1 Plant) for Home Decor Items,Office,Living Room,Bedroom,Tv Table,Birthday Gift (Pac...",https://m.media-amazon.com/images/I/6107pG08y3L._AC_UL320_.jpg,4.2,"48,400"
1017,Saraswati Idol for Decoration and Pooja,https://m.media-amazon.com/images/I/71DHaIN6v0L._AC_UL320_.jpg,4.4,"48,450"
1018,Decort- House Hold Decorations Rose Gold Steel Grid Photo Frame for Wall | 16 in X 20 in | 8 Wooden Clips Included | Rose ...,https://m.media-amazon.com/images/I/618sOcEsM3L._AC_UL320_.jpg,4.4,"48,850"
1019,"Delush Design Artificial Flowers (Multicolour, 144 Piece)",https://m.media-amazon.com/images/I/511qHjYu4dL._AC_UL320_.jpg,4,4800
1020,Raksha Bandhan Rakhi Combo Set Brother - Rakhi Gifts for Bhaiya Bhabhi - Lord Ganesha Idol Statue/Special Greeting Card/Lu...,https://m.media-amazon.com/images/I/71ddDO4YZ8L._AC_UL320_.jpg,4.3,4899
1021,"EISCO - Newton's Cradle (Collision Balls / Pendulum Balls), 18cmX15cmX17.5cm with 5 Steel Balls of 2.2cm Dia Each ,Perfect...",https://m.media-amazon.com/images/I/81Ihez+uKyL._AC_UL320_.jpg,4.1,"48,590"
1022,"PRISTINDIA INTERNATIONAL Dream Catcher for Car's Interior Mirror, Wall Hanging and Wedding Ornament for Positive Vibes (Bu...",https://m.media-amazon.com/images/I/61gHG1TuW8L._AC_UL320_.jpg,4.2,4899
1023,"Wall1ders 40 Cut Butterfly Golden, Mirror Stickers for Wall, Acrylic Mirror Wall Decor Sticker, Wall Sticker for Hall Roo...",https://m.media-amazon.com/images/I/61bS5IE+ODL._AC_UL320_.jpg,3.8,4899
1024,"Decent Glass Terrarium Glass Bubble Bowl, Fish Bowl, Rose Bowl - Glass Round Vase, Events, Decorating, Home Decor, or Offi...",https://m.media-amazon.com/images/I/71vJOirkUSL._AC_UL320_.jpg,4.2,"48,000"
1025,Aviraj Kasturi Incense Dhoop Cones for Pooja 1kg Pack Doop Cone I Kasturi Fragrance Yello Cones Non-ToXic,https://m.media-amazon.com/images/I/71C8xYyvteL._AC_UL320_.jpg,4.2,4800
1026,"Saumic Craft Set Of 5 Framed Wall Paintings For Living Room Big Size , Home Decoration , Bedroom , Hall Large Size Wall De...",https://m.media-amazon.com/images/I/81Nt45bKngL._AC_UL320_.jpg,3.7,"48,499"
1027,"Qatalitic Plastic Round Cartoon Emoji Smile Smiley Face Fridge Magnets (Multicolour, 3 cm Diameter)",https://m.media-amazon.com/images/I/5140vGqsZVL._AC_UL320_.jpg,4.1,4899
1028,RoomDecor Wood Candle Holder/Candle Stand Pillar in Natural Look Set of 2 (Brown),https://m.media-amazon.com/images/I/81cERbDkhVL._AC_UL320_.jpg,4,"48,499"
1029,"SAF Set of 4 Camera, Recorder, Guitar, Headphone Musical Instrument UV Coated Home Decorative Gift Item Framed Painting 19...",https://m.media-amazon.com/images/I/61-XOw0HetS._AC_UL320_.jpg,4.1,"48,889"
1030,"CHIVYA Digital LCD Voice Talking Function, LED Wall/Ceiling Projection, Alarm/Snooze/Temperature Display, 12hr/24hr, Bedsi...",https://m.media-amazon.com/images/I/51VgClS8IDL._AC_UL320_.jpg,4.2,4899
1031,"SHREERANG Flower Press Kit, Multi Layer Flower Pressing Kit For Adults And Kids Making Dried Pressed Flowers Leaves For Di...",https://m.media-amazon.com/images/I/61UvuqfTvrL._AC_UL320_.jpg,4.2,"48,999"
1032,"GRAY WALL Inglourious Basterds movie Framed Poster For Room & Office (10 Inch X 13 Inch, White)",https://m.media-amazon.com/images/I/81DHmx3ftuL._AC_UL320_.jpg,4.5,4899
1033,RITUALISTIC Pastel Blooms Iron Wall Art (Multicolor) - Set of 5 |Home Decor | Painting | Divine | Intricate Designs,https://m.media-amazon.com/images/W/IMAGERENDERING_521856-T2/images/I/71Qe0E4h38L._AC_UL320_.jpg,5,"48,499"
1034,"ARTISKRITI Evil Eye Hanging for Home Entrance Door Decoration, Nazar Battu for Home Decoration",https://m.media-amazon.com/images/W/IMAGERENDERING_521856-T2/images/I/71fVRk1jktL._AC_UL320_.jpg,4.2,4899
1035,Decent | MY HOOKAH Glass Metal Petite Hookah (10 INCH) (MULTI COLOURS) ASSORTED COLOURS,https://m.media-amazon.com/images/W/IMAGERENDERING_521856-T2/images/I/81pCWALtKIL._AC_UL320_.jpg,3,"48,999"
1036,Evelyn Analog Table Clock Classic Small Round Alarm Car Dashboard Time Desk Watch White Size 45mm,https://m.media-amazon.com/images/W/IMAGERENDERING_521856-T2/images/I/71czxViCsYL._AC_UL320_.jpg,3.7,4899
1037,"Decals Design 'Pious Lord Ganesha' Wall Sticker (PVC Vinyl, 60 cm X 60 cm, Black)",https://m.media-amazon.com/images/W/IMAGERENDERING_521856-T2/images/I/71VVwLWlMvL._AC_UL320_.jpg,4.4,4864
1038,GADGETS WRAP Vinyl Decal Sticker Sidhu Moosewala (Item Finish Size : 13cm X 13cm),https://m.media-amazon.com/images/W/IMAGERENDERING_521856-T2/images/I/710zjLcIt5L._AC_UL320_.jpg,4.2,4868
1039,ARCADIA Modern Handcrafted luXury Metal Wall Decor Perfect for Living Room//Drawing Room//Hotel // Restaurant // (Color : ...,https://m.media-amazon.com/images/W/IMAGERENDERING_521856-T2/images/I/61DKdWXXxAS._AC_UL320_.jpg,3.2,"482,999"
1040,"OM Shree,Art and Craft Wooden Temple Beautiful Plywood Mandir Pooja Room Home Decor Office OR Home Temple (Red)",https://m.media-amazon.com/images/W/IMAGERENDERING_521856-T2/images/I/61KyUnOZpTL._AC_UL320_.jpg,4.1,4899
1041,Indianara 3 Piece Set of Framed Kitchen Room Wall Hanging Decor(1067) Art Prints 8.7 INCH X 8.7 INCH Without Glass,https://m.media-amazon.com/images/W/IMAGERENDERING_521856-T2/images/I/8109kJzHRfL._AC_UL320_.jpg,4.3,"48,200"
1042,"Deer Face Acrylic Classic Stylish Wall Clock for Home Living Room Hall Office Bedroom Decor Medium Size, 60 cm X 60 cm (De...",https://m.media-amazon.com/images/W/IMAGERENDERING_521856-T2/images/I/51MNHgXedFL._AC_UL320_.jpg,2.5,4899
1043,"Besnik Arts Metal Handmade Indian Design Akhand Jyot Diya for Diwali Puja, Festivals, Decoration, Mandir & Home Dcor 5 St...",https://m.media-amazon.com/images/W/IMAGERENDERING_521856-T2/images/I/71eWGZ8GbpL._AC_UL320_.jpg,4.2,"48,299"
1044,PUJA Jitesh Arts Lord Krishna Arjun Geeta Updesh Painting For Wall With Frame With Glass 11inch X 14inch,https://m.media-amazon.com/images/W/IMAGERENDERING_521856-T2/images/I/61-vowLSVoL._AC_UL320_.jpg,4.1,4850
1045,"Wall1ders 12 Rings 12 Circles Golden, Mirror Stickers for Wall, Acrylic Stickers, Wall Mirror Stickers, Wall Stickers for ...",https://m.media-amazon.com/images/W/IMAGERENDERING_521856-T2/images/I/61cFzjEvN3L._AC_UL320_.jpg,4.2,4899
